,pathway,pthwy_id,fold_enrichment,q-value,cohort
1386,response to lectin,GO:1990840,3.6349514563106795,0.00809385313271346,symptomatic
1385,cellular response to lectin,GO:1990858,3.6349514563106795,0.008098773408174076,symptomatic
823,glomerulus vasculature development,GO:0072012,3.6349514563106795,0.008103699669371262,symptomatic
1471,semi-lunar valve development,GO:1905314,3.615616608138814,2.657660876160884e-05,symptomatic
940,regulation of protein import into nucleus,GO:0042306,3.6051567722425593,1.041952675689434e-06,symptomatic
1393,negative regulation of cysteine-type endopeptidase activity involved in apoptotic process,GO:0043154,3.598601941747573,1.4828627572522164e-05,symptomatic
1397,positive regulation of cardiac muscle hypertrophy,GO:0010613,3.598601941747573,0.00462529257194722,symptomatic
1278,negative regulation of purine nucleotide metabolic process,GO:1900543,3.598601941747573,0.0046283843450568105,symptomatic
762,regulation of muscle cell apoptotic process,GO:0010660,3.598601941747573,3.8200864056293124e-08,symptomatic
1029,regulation of smooth muscle cell proliferation,GO:0048660,3.595725361458406,8.466250145553368e-15,symptomatic
597,regulation of stress-activated protein kinase signaling cascade,GO:0070302,3.5883495145631064,0.00020018524740131696,symptomatic
1007,regulation of membrane permeability,GO:0090559,3.580698449500072,3.1645433190358224e-07,symptomatic
906,T cell lineage commitment,GO:0002360,3.5700416088765605,0.0026726175749136735,symptomatic
1401,miRNA-mediated post-transcriptional gene silencing,GO:0035195,3.5700416088765605,0.0026647337472590605,symptomatic
838,positive regulation of chromosome segregation,GO:0051984,3.5700416088765605,0.0026706422478073068,symptomatic
1399,glandular epithelial cell development,GO:0002068,3.5700416088765605,0.0026667003404304696,symptomatic
173,positive regulation of monooxygenase activity,GO:0032770,3.5700416088765605,0.002668669838466238,symptomatic
1472,heart valve development,GO:0003170,3.56026067296183,9.549829985403664e-08,symptomatic
1404,positive regulation of viral genome replication,GO:0045070,3.547009082367679,0.0015307863239159166,symptomatic
1407,negative regulation of protein processing,GO:0010955,3.547009082367679,0.0015295488248666716,symptomatic
1421,negative regulation of muscle cell differentiation,GO:0051148,3.547009082367679,1.4305794291693157e-06,symptomatic
1392,peptidyl-threonine modification,GO:0018210,3.5370873786407766,7.938572032508836e-07,symptomatic
881,epithelial to mesenchymal transition,GO:0001837,3.5280411193603656,9.069264473100593e-09,symptomatic
1432,branch elongation of an epithelium,GO:0060602,3.528041119360365,0.03274494334828547,symptomatic
1429,mammary gland epithelial cell differentiation,GO:0060644,3.528041119360365,0.032760054074334514,symptomatic
1294,regulation of vascular endothelial growth factor production,GO:0010574,3.528041119360365,0.0008535454985656345,symptomatic
229,regulation of epithelial cell differentiation involved in kidney development,GO:2000696,3.528041119360365,0.032896680805877154,symptomatic
1426,positive regulation of nitric-oxide synthase activity,GO:0051000,3.528041119360365,0.03280547004578692,symptomatic
1422,positive regulation of membrane protein ectodomain proteolysis,GO:0051044,3.528041119360365,0.03282063669860513,symptomatic
1110,regulation of nucleobase-containing compound transport,GO:0032239,3.528041119360365,0.032851012114337295,symptomatic
1419,negative regulation of smooth muscle cell differentiation,GO:0051151,3.528041119360365,0.03283581738162946,symptomatic
1418,regulation of pigmentation,GO:0120305,3.528041119360365,0.032866220916242084,symptomatic
1415,response to vitamin A,GO:0033189,3.528041119360365,0.03288144380689342,symptomatic
1411,positive regulation of homotypic cell-cell adhesion,GO:0034112,3.528041119360365,0.032911931932815434,symptomatic
339,ganglion development,GO:0061548,3.528041119360365,0.032775178753039196,symptomatic
1428,myelin maintenance,GO:0043217,3.528041119360365,0.03279031740373344,symptomatic
1095,positive regulation of gliogenesis,GO:0014015,3.5197593326952004,2.4029542509716974e-07,symptomatic
962,positive regulation of mitotic cell cycle phase transition,GO:1901992,3.5151178918169212,2.8310536342952692e-09,symptomatic
942,positive regulation of protein localization to nucleus,GO:1900182,3.5037934140726654,8.627648280381529e-10,symptomatic
1462,positive regulation of smooth muscle cell migration,GO:0014911,3.498640776699029,0.0002733646190977281,symptomatic
1438,regulation of skeletal muscle cell differentiation,GO:2001014,3.498640776699029,0.01858643482741238,symptomatic
85,transport of virus,GO:0046794,3.498640776699029,0.01851995294504555,symptomatic
1449,nuclear-transcribed mRNA poly(A) tail shortening,GO:0000289,3.498640776699029,0.018538899188467593,symptomatic
1447,mitochondrion distribution,GO:0048311,3.498640776699029,0.01854838685437776,symptomatic
1445,response to salt stress,GO:0009651,3.498640776699029,0.018557884236279642,symptomatic
1442,immune response-regulating cell surface receptor signaling pathway involved in phagocytosis,GO:0002433,3.498640776699029,0.01859597122291131,symptomatic
1439,Fc-gamma receptor signaling pathway involved in phagocytosis,GO:0038096,3.498640776699029,0.01857690820781863,symptomatic
1443,negative regulation of release of cytochrome c from mitochondria,GO:0090201,3.498640776699029,0.018567391349105608,symptomatic
1436,Golgi to vacuole transport,GO:0006896,3.498640776699029,0.01860551740937071,symptomatic
332,regulation of triglyceride biosynthetic process,GO:0010866,3.498640776699029,0.018529421223647313,symptomatic
1495,aortic valve development,GO:0003176,3.487017385414315,0.0001542171679695779,symptomatic
1464,positive regulation of DNA replication,GO:0045740,3.487017385414315,0.00015454424573833629,symptomatic
640,regulation of amyloid precursor protein catabolic process,GO:1902991,3.487017385414315,0.00015438053361361347,symptomatic
952,regulation of signal transduction by p53 class mediator,GO:1901796,3.484884653068496,7.74757836974557e-11,symptomatic
1179,phosphatidylinositol phosphate biosynthetic process,GO:0046854,3.483495145631068,1.0822345782336139e-06,symptomatic
1033,extrinsic apoptotic signaling pathway,GO:0097191,3.4807905686546468,4.296330040721972e-11,symptomatic
1643,positive regulation of glial cell differentiation,GO:0045687,3.4769100886449977,8.61651533909437e-05,symptomatic
1522,negative regulation of membrane permeability,GO:1905709,3.4769100886449977,0.010572939741483737,symptomatic
1466,negative regulation of stem cell proliferation,GO:2000647,3.4769100886449977,0.010578936871229332,symptomatic
1467,atrial septum development,GO:0003283,3.4769100886449977,0.010566949407352587,symptomatic
1470,pulmonary valve development,GO:0003177,3.4769100886449977,0.010560965857291797,symptomatic
1473,epidermal growth factor receptor signaling pathway,GO:0007173,3.4680404200515156,4.847200209556434e-05,symptomatic
1276,negative regulation of nucleotide metabolic process,GO:0045980,3.460194174757281,0.006123208457460635,symptomatic
1475,negative regulation of glial cell differentiation,GO:0045686,3.460194174757281,0.006146594358634896,symptomatic
1476,negative regulation of fat cell differentiation,GO:0045599,3.460194174757281,2.7368990158404666e-05,symptomatic
1478,cellular response to gamma radiation,GO:0071480,3.460194174757281,0.006138779235483421,symptomatic
1480,atrioventricular valve morphogenesis,GO:0003181,3.460194174757281,0.006115452651941369,symptomatic
1427,regulation of nitric-oxide synthase activity,GO:0050999,3.460194174757281,0.0061348791216108145,symptomatic
1398,positive regulation of muscle hypertrophy,GO:0014742,3.460194174757281,0.006119328097221433,symptomatic
811,regulation of cardiocyte differentiation,GO:1905207,3.460194174757281,0.006127093742014861,symptomatic
1264,regulation of vascular endothelial cell proliferation,GO:1905562,3.460194174757281,0.00613098396026376,symptomatic
1519,positive regulation of muscle tissue development,GO:1901863,3.460194174757281,0.006142684311332965,symptomatic
1563,prostate gland morphogenesis,GO:0060512,3.460194174757281,0.006111582112288242,symptomatic
1484,Golgi to plasma membrane protein transport,GO:0043001,3.4469367258118515,0.003520531620114176,symptomatic
1483,negative regulation of oxidative stress-induced intrinsic apoptotic signaling pathway,GO:1902176,3.4469367258118515,0.0035230004361170614,symptomatic
1130,positive regulation of epithelial cell migration,GO:0010634,3.4423712467048158,1.7413919134809235e-14,symptomatic
1481,heart valve morphogenesis,GO:0003179,3.4412860098678975,4.668585673834809e-06,symptomatic
1226,cardiac muscle hypertrophy,GO:0003300,3.4361650485436894,0.0020309436551354454,symptomatic
1493,insulin-like growth factor receptor signaling pathway,GO:0048009,3.4361650485436894,0.0020325168105615765,symptomatic
1410,negative regulation of protein maturation,GO:1903318,3.4361650485436894,0.0020293729330510403,symptomatic
580,response to interleukin-6,GO:0070741,3.4361650485436894,0.0020340924049883683,symptomatic
595,regulation of stress-activated MAPK cascade,GO:0032872,3.4272399445214976,0.001153505828871535,symptomatic
1060,regulation of cardiac muscle cell proliferation,GO:0060043,3.4197240674501788,0.0006508570913834376,symptomatic
1494,aortic valve morphogenesis,GO:0003180,3.4197240674501788,0.000649686485103971,symptomatic
1047,regulation of ubiquitin-protein transferase activity,GO:0051438,3.4197240674501788,0.000650271261418196,symptomatic
1496,positive regulation of nitric oxide biosynthetic process,GO:0045429,3.413308074828321,0.0003620043616791223,symptomatic
1177,positive regulation of endothelial cell migration,GO:0010595,3.3949074922146916,6.54441973438454e-10,symptomatic
1500,cellular response to hydrogen peroxide,GO:0070301,3.3833009708737865,3.4986052499637496e-06,symptomatic
1446,response to osmotic stress,GO:0006970,3.378968959387392,1.086512656184457e-06,symptomatic
1117,mitotic cell cycle phase transition,GO:0044772,3.377997991295614,2.5952862904669667e-13,symptomatic
253,regulation of glial cell differentiation,GO:0045685,3.3753120665742022,3.277727378003048e-07,symptomatic
1540,cellular response to acid chemical,GO:0071229,3.3694774735464166,3.020969210917376e-08,symptomatic
1118,cell cycle phase transition,GO:0044770,3.3531276883372247,3.179222975862293e-14,symptomatic
1520,negative regulation of phagocytosis,GO:0050765,3.3320388349514567,0.024469383417940645,symptomatic
164,tongue development,GO:0043586,3.3320388349514567,0.024457347321817702,symptomatic
403,regulation of oxidative stress-induced intrinsic apoptotic signaling pathway,GO:1902175,3.3320388349514567,0.00047870472984637376,symptomatic
1161,negative regulation of B cell activation,GO:0050869,3.3320388349514567,0.00265567164816841,symptomatic
1530,mammary gland lobule development,GO:0061377,3.3320388349514567,0.024397344016317657,symptomatic
1516,positive regulation of skeletal muscle tissue development,GO:0048643,3.3320388349514567,0.024481431366447752,symptomatic
1497,positive regulation of nitric oxide metabolic process,GO:1904407,3.3320388349514567,0.0004782631203169952,symptomatic
1004,regulation of mitochondrial membrane permeability involved in apoptotic process,GO:1902108,3.3320388349514567,0.02449349118485487,symptomatic
1529,mammary gland alveolus development,GO:0060749,3.3320388349514567,0.024373425051595777,symptomatic
1507,cell migration involved in sprouting angiogenesis,GO:0002042,3.3320388349514567,0.024505562890712363,symptomatic
1521,negative regulation of mitochondrial membrane permeability,GO:0035795,3.3320388349514567,0.024445323060597535,symptomatic
1506,ER-nucleus signaling pathway,GO:0006984,3.3320388349514567,0.0026576417309934607,symptomatic
1528,miRNA metabolic process,GO:0010586,3.3320388349514567,0.024385378668590186,symptomatic
1527,intracellular estrogen receptor signaling pathway,GO:0030520,3.3320388349514567,0.024409321112054683,symptomatic
1523,cellular response to platelet-derived growth factor stimulus,GO:0036120,3.3320388349514567,0.024433310616833116,symptomatic
1227,striated muscle hypertrophy,GO:0014897,3.3320388349514567,0.002653704483984582,symptomatic
1525,response to hyperoxia,GO:0055093,3.3320388349514567,0.024421309973111684,symptomatic
661,response to X-ray,GO:0010165,3.3320388349514563,0.008069201067858823,symptomatic
1549,"alternative mRNA splicing, via spliceosome",GO:0000380,3.3320388349514563,0.013756503849810973,symptomatic
1219,regulation of amyloid-beta formation,GO:1902003,3.3320388349514563,0.001525075649031543,symptomatic
967,positive regulation of chromosome separation,GO:1905820,3.3320388349514563,0.0046073978862921725,symptomatic
1557,piecemeal microautophagy of the nucleus,GO:0034727,3.3320388349514563,0.042764284126126234,symptomatic
1313,negative regulation of signaling receptor activity,GO:2000272,3.3320388349514563,0.008064274815680643,symptomatic
1402,regulatory ncRNA-mediated post-transcriptional gene silencing,GO:0035194,3.3320388349514563,0.0015213650026835344,symptomatic
1420,regulation of smooth muscle cell differentiation,GO:0051150,3.3320388349514563,0.0015238367573588937,symptomatic
633,programmed necrotic cell death,GO:0097300,3.3320388349514563,0.008049532082928027,symptomatic
1559,nucleophagy,GO:0044804,3.3320388349514563,0.04280179665606144,symptomatic
1561,negative regulation of organ growth,GO:0046621,3.3320388349514563,0.004601221749715373,symptomatic
1555,negative regulation of steroid biosynthetic process,GO:0010894,3.3320388349514563,0.013749099918783089,symptomatic
626,positive regulation of microtubule polymerization or depolymerization,GO:0031112,3.3320388349514563,0.0015225998768740243,symptomatic
1545,positive regulation of myelination,GO:0031643,3.3320388349514563,0.042783032168268335,symptomatic
1767,positive regulation of ERBB signaling pathway,GO:1901186,3.3320388349514563,0.0046043077468647465,symptomatic
1547,amyloid fibril formation,GO:1990000,3.3320388349514563,0.008054440334198104,symptomatic
1541,"mitochondrial electron transport, cytochrome c to oxygen",GO:0006123,3.3320388349514563,0.013763915759212812,symptomatic
925,lung epithelium development,GO:0060428,3.3320388349514563,0.000849125629478209,symptomatic
1538,B cell homeostasis,GO:0001782,3.3320388349514563,0.004610492176343409,symptomatic
1784,glial cell migration,GO:0008347,3.3320388349514563,0.0001533540383132305,symptomatic
1537,negative regulation of cellular senescence,GO:2000773,3.3320388349514563,0.013771335659891632,symptomatic
1534,specification of animal organ identity,GO:0010092,3.3320388349514563,0.04282057761115405,symptomatic
1539,cellular response to amino acid stimulus,GO:0071230,3.3320388349514563,2.419631386932331e-07,symptomatic
1562,prostate gland epithelium morphogenesis,GO:0060740,3.3320388349514563,0.013741703953253888,symptomatic
857,apoptotic mitochondrial changes,GO:0008637,3.3320388349514563,1.514689268392987e-05,symptomatic
320,regulation of polysaccharide biosynthetic process,GO:0032885,3.3320388349514563,0.0015263165568013002,symptomatic
841,response to antibiotic,GO:0046677,3.3320388349514563,0.0008476641395823773,symptomatic
1517,regulation of skeletal muscle tissue development,GO:0048641,3.3320388349514563,0.00805935457479249,symptomatic
1232,striated muscle adaptation,GO:0014888,3.3320388349514563,0.004598139886520654,symptomatic
174,regulation of monooxygenase activity,GO:0032768,3.3320388349514563,0.0008483942551203465,symptomatic
1531,regulation of megakaryocyte differentiation,GO:0045652,3.3320388349514563,0.013778763564778305,symptomatic
1061,regulation of cardiac muscle tissue growth,GO:0055021,3.3320388349514563,4.8326721162403345e-05,symptomatic
933,positive regulation of intracellular protein transport,GO:0090316,3.2976879191272146,1.633225623274631e-08,symptomatic
1619,ventricular septum development,GO:0003281,3.2863944673493815,1.920253896472895e-06,symptomatic
480,"negative regulation of gene expression, epigenetic",GO:0045814,3.273064696279749,1.1384708861459287e-09,symptomatic
1692,cell cycle G2/M phase transition,GO:0044839,3.2714563106796115,6.334080897993293e-05,symptomatic
1579,cellular response to glucocorticoid stimulus,GO:0071385,3.2714563106796115,6.326741290927252e-05,symptomatic
452,positive regulation of protein binding,GO:0032092,3.2714563106796115,6.319418673692382e-05,symptomatic
805,canonical NF-kappaB signal transduction,GO:0007249,3.2640380424014266,0.0001978543155893485,symptomatic
1071,"DNA damage response, signal transduction by p53 class mediator",GO:0030330,3.254549559720027,0.0006320021042619151,symptomatic
176,positive regulation of oxidoreductase activity,GO:0051353,3.254549559720027,0.0006325745699360654,symptomatic
1565,phosphatidylinositol 3-kinase/protein kinase B signal transduction,GO:0043491,3.251748742542987,4.2482100273059747e-07,symptomatic
949,regulation of stem cell proliferation,GO:0072091,3.251748742542987,4.255422607997496e-07,symptomatic
1566,negative regulation of striated muscle cell differentiation,GO:0051154,3.2419837313041198,0.0019636310901896014,symptomatic
1287,negative regulation of intrinsic apoptotic signaling pathway,GO:2001243,3.239482200647249,4.886307530658323e-09,symptomatic
646,response to growth hormone,GO:0060416,3.2340376927470014,0.0034165174022151115,symptomatic
1022,miRNA processing,GO:0035196,3.2340376927470014,0.0034068594024915353,symptomatic
1567,protein export from nucleus,GO:0006611,3.2340376927470014,0.003414097772326857,symptomatic
1704,regulation of mesenchymal cell proliferation,GO:0010464,3.2340376927470014,0.0034044534283372333,symptomatic
953,negative regulation of signal transduction by p53 class mediator,GO:1901797,3.2340376927470014,0.0034116815672509005,symptomatic
1568,postreplication repair,GO:0006301,3.2340376927470014,0.00340926877972102,symptomatic
120,positive regulation of viral process,GO:0048524,3.2295145631067963,1.4593921685432807e-05,symptomatic
1570,transforming growth factor beta receptor signaling pathway,GO:0007179,3.227912621359223,5.1079408491683655e-08,symptomatic
1611,regulation of mitochondrial fission,GO:0090140,3.2245537112433444,0.005911078269448703,symptomatic
1574,placenta blood vessel development,GO:0060674,3.2245537112433444,0.005903519345830483,symptomatic
1266,positive regulation of signal transduction by p53 class mediator,GO:1901798,3.2245537112433444,0.005914864994797485,symptomatic
413,positive regulation of intrinsic apoptotic signaling pathway,GO:2001244,3.2245537112433444,2.6187534620635714e-05,symptomatic
1356,regulation of endoplasmic reticulum unfolded protein response,GO:1900101,3.2245537112433444,0.005907296389557821,symptomatic
1246,negative regulation of cell-substrate adhesion,GO:0010812,3.219088365970051,4.650666246624937e-05,symptomatic
1575,cellular response to dexamethasone stimulus,GO:0071549,3.2130374479889046,0.010250987282897755,symptomatic
1581,negative regulation of protein dephosphorylation,GO:0035308,3.2130374479889046,0.010245072114240573,symptomatic
1583,positive regulation of translational initiation,GO:0045948,3.2130374479889046,0.010239163768153928,symptomatic
1058,regulation of stem cell differentiation,GO:2000736,3.2086299892125134,1.0186181586801356e-06,symptomatic
1096,regulation of gliogenesis,GO:0014013,3.206301520424986,1.1490134918137446e-08,symptomatic
526,modulation by host of viral genome replication,GO:0044827,3.1987572815533984,0.017712447610511686,symptomatic
1589,"establishment of mitochondrion localization, microtubule-mediated",GO:0034643,3.1987572815533984,0.017675945915281367,symptomatic
1588,mitochondrion transport along microtubule,GO:0047497,3.1987572815533984,0.01768505722760883,symptomatic
1585,Rac protein signal transduction,GO:0016601,3.1987572815533984,0.01770330806066106,symptomatic
1587,regulation of cell fate specification,GO:0042659,3.1987572815533984,0.017694177937886094,symptomatic
1591,ventricular cardiac muscle tissue morphogenesis,GO:0055010,3.1902499483577773,0.00045836956443035773,symptomatic
713,regulation of phosphoprotein phosphatase activity,GO:0043666,3.1902499483577773,0.0004587975472169407,symptomatic
1601,insulin receptor signaling pathway,GO:0008286,3.1871675812579148,1.0498559935793173e-05,symptomatic
1633,regulation of fibroblast proliferation,GO:0048145,3.1855755894590847,2.230482706007916e-07,symptomatic
1440,Fc receptor mediated stimulatory signaling pathway,GO:0002431,3.1805825242718444,0.031084869228868335,symptomatic
1612,positive regulation of G1/S transition of mitotic cell cycle,GO:1900087,3.1805825242718444,0.0008063928977414698,symptomatic
1607,"negative regulation of DNA-templated transcription, elongation",GO:0032785,3.1805825242718444,0.03105592614764965,symptomatic
1610,positive regulation of mitochondrial fission,GO:0090141,3.1805825242718444,0.031041474809284063,symptomatic
1296,endolysosomal toll-like receptor signaling pathway,GO:0140894,3.1805825242718444,0.031099361009394616,symptomatic
1604,regulation of superoxide anion generation,GO:0032928,3.1805825242718444,0.031070390947904727,symptomatic
1609,negative regulation of reactive oxygen species metabolic process,GO:2000378,3.1805825242718444,0.0008070922844697798,symptomatic
513,negative regulation of translation,GO:0017148,3.1770602844885976,3.12519688399453e-10,symptomatic
1615,regulation of cell-substrate junction assembly,GO:0090109,3.173370319001387,3.358461106340135e-05,symptomatic
542,intracellular steroid hormone receptor signaling pathway,GO:0030518,3.173370319001387,3.354340295166712e-05,symptomatic
1614,regulation of focal adhesion assembly,GO:0051893,3.173370319001387,3.362592054810418e-05,symptomatic
1394,regulation of cysteine-type endopeptidase activity involved in apoptotic process,GO:0043281,3.169500355197727,7.126902859922424e-13,symptomatic
1617,ventricular septum morphogenesis,GO:0060412,3.169500355197727,0.0014448710960355006,symptomatic
1710,regulation of striated muscle cell apoptotic process,GO:0010662,3.169500355197727,0.0014436896805849401,symptomatic
1283,regulation of carbohydrate catabolic process,GO:0043470,3.1654368932038834,6.0055174268134774e-05,symptomatic
487,regulation of muscle adaptation,GO:0043502,3.1633280078653065,2.3819061013579506e-06,symptomatic
1505,response to hydrogen peroxide,GO:0042542,3.162036853576382,8.761504546742618e-08,symptomatic
1288,negative regulation of apoptotic signaling pathway,GO:2001234,3.161165048543689,3.6200385893582596e-18,symptomatic
1352,intrinsic apoptotic signaling pathway by p53 class mediator,GO:0072332,3.1566683699540112,0.0001065532216280454,symptomatic
1622,negative regulation of insulin receptor signaling pathway,GO:0046627,3.156668369954011,0.0025073047525271766,symptomatic
1620,cellular response to estradiol stimulus,GO:0071392,3.156668369954011,0.002509178672372115,symptomatic
479,heterochromatin organization,GO:0070828,3.1519286276567833,1.081899664922385e-08,symptomatic
963,positive regulation of cell cycle phase transition,GO:1901989,3.1519286276567833,1.084158328105939e-08,symptomatic
1085,negative regulation of G1/S transition of mitotic cell cycle,GO:2000134,3.149461364543157,7.626508636023284e-06,symptomatic
383,vasculogenesis,GO:0001570,3.149461364543157,7.637175081668071e-06,symptomatic
458,post-embryonic development,GO:0009791,3.1448456419766555,5.270789674959967e-07,symptomatic
1632,negative regulation of fibroblast proliferation,GO:0048147,3.1416366158113727,0.0043715830906743,symptomatic
1228,muscle hypertrophy,GO:0014896,3.1416366158113727,0.004368599074912747,symptomatic
1358,cardiac ventricle morphogenesis,GO:0003208,3.1416366158113727,1.3669118518679685e-05,symptomatic
1626,negative regulation of blood vessel endothelial cell migration,GO:0043537,3.1416366158113727,0.004374571185746531,symptomatic
1274,regulation of nucleotide catabolic process,GO:0030811,3.136036550542547,0.0003308301063044795,symptomatic
1479,response to gamma radiation,GO:0010332,3.136036550542547,0.0003305120004330329,symptomatic
888,endocardial cushion development,GO:0003197,3.136036550542547,0.0003301945057159983,symptomatic
1281,regulation of glycolytic process,GO:0006110,3.136036550542547,0.00033114882509668035,symptomatic
1280,regulation of purine nucleotide catabolic process,GO:0033121,3.136036550542547,0.00033146815858279096,symptomatic
404,regulation of intrinsic apoptotic signaling pathway,GO:2001242,3.1306518723994454,8.008336792274035e-14,symptomatic
1634,DNA methylation,GO:0006306,3.1237864077669903,0.007591347400538846,symptomatic
1400,glandular epithelial cell differentiation,GO:0002067,3.1237864077669903,4.3536241268627836e-05,symptomatic
1635,DNA alkylation,GO:0006305,3.1237864077669903,0.007586641047531692,symptomatic
1086,negative regulation of cell cycle G1/S phase transition,GO:1902807,3.12378640776699,3.067118919584377e-06,symptomatic
955,neuron apoptotic process,GO:0051402,3.1180546895876016,2.5048344091979716e-08,symptomatic
446,columnar/cuboidal epithelial cell differentiation,GO:0002065,3.1180546895876016,2.5097651855940305e-08,symptomatic
1740,outflow tract morphogenesis,GO:0003151,3.1156726768377254,5.454162591716885e-06,symptomatic
1571,cellular response to transforming growth factor beta stimulus,GO:0071560,3.1156726768377254,1.3563996467219234e-11,symptomatic
115,cellular response to decreased oxygen levels,GO:0036294,3.114731954411144,2.0939670167113198e-10,symptomatic
964,positive regulation of mitotic cell cycle,GO:0045931,3.113544485118574,3.1402822779382164e-09,symptomatic
100,intrinsic apoptotic signaling pathway,GO:0097193,3.112563223068426,1.5707875320386499e-12,symptomatic
970,positive regulation of mitotic nuclear division,GO:0045840,3.1099029126213593,0.001033126763126049,symptomatic
1066,positive regulation of organ growth,GO:0046622,3.1099029126213593,0.0010348689667738164,symptomatic
1637,macrophage differentiation,GO:0030225,3.1099029126213593,0.0010339971310815048,symptomatic
