,pathway,pthwy_id,fold_enrichment,q-value,cohort
233,regulation of multicellular organismal development,GO:2000026,2.0647249190938513,5.8926255630235685e-33,symptomatic
2048,regulation of cytokinesis,GO:0032465,2.0644153651329673,0.018496150553837718,symptomatic
2257,embryonic epithelial tube formation,GO:0001838,2.0626907073509013,0.00462477938179262,symptomatic
2205,protein stabilization,GO:0050821,2.0619791893421566,4.655112726203538e-05,symptomatic
599,negative regulation of MAPK cascade,GO:0043409,2.0616990291262134,0.0006987937171838035,symptomatic
298,establishment or maintenance of cell polarity,GO:0007163,2.0580239862935468,9.162389380895372e-05,symptomatic
2206,cardiac cell development,GO:0055006,2.0580239862935463,0.0488598635314964,symptomatic
1779,forebrain development,GO:0030900,2.0573121135898824,4.237091328412029e-09,symptomatic
2168,microtubule organizing center organization,GO:0031023,2.0552762907177207,0.008679026293039824,symptomatic
1083,cell cycle,GO:0007049,2.0545377796538626,8.522868115614195e-29,symptomatic
2207,regulation of cilium assembly,GO:1902017,2.0539965420933632,0.038474505895147046,symptomatic
2210,regulation of alpha-beta T cell differentiation,GO:0046637,2.0539965420933632,0.03844010758858008,symptomatic
1509,endothelial cell migration,GO:0043542,2.0539965420933632,0.03845729904993454,symptomatic
2198,symbiont entry into host,GO:0044409,2.0527739251040225,0.006957618272114834,symptomatic
1969,"regulation of mRNA splicing, via spliceosome",GO:0048024,2.0527739251040225,0.00694892124927469,symptomatic
2030,female sex differentiation,GO:0046660,2.0527739251040225,0.006944580886220802,symptomatic
1956,developmental cell growth,GO:0048588,2.0527739251040225,0.006953267041175424,symptomatic
296,regulation of cell adhesion,GO:0030155,2.0524345675366384,1.4426590908195283e-17,symptomatic
1849,leukocyte proliferation,GO:0070661,2.052182858612486,0.0012534002001511875,symptomatic
916,reproductive structure development,GO:0048608,2.052182858612486,8.734707617858537e-07,symptomatic
433,regulation of mRNA metabolic process,GO:1903311,2.051320325100408,6.804909310040583e-07,symptomatic
2214,neural crest cell development,GO:0014032,2.0504854368932035,0.04387302606336024,symptomatic
1926,negative regulation of protein-containing complex disassembly,GO:0043242,2.0504854368932035,0.04385392592140841,symptomatic
2218,Ras protein signal transduction,GO:0007265,2.0473973564159547,0.03331236325982778,symptomatic
355,hemopoiesis,GO:0030097,2.044985207716988,3.157512848955625e-15,symptomatic
475,chromatin organization,GO:0006325,2.0434769417475724,8.176000878947006e-17,symptomatic
1774,response to light stimulus,GO:0009416,2.0432313610551383,6.079511152208158e-07,symptomatic
2227,regulation of canonical NF-kappaB signal transduction,GO:0043122,2.0422173504541186,3.7275765473347303e-06,symptomatic
583,regulation of cell migration,GO:0030334,2.0417599669489777,1.2771852312644642e-20,symptomatic
146,negative regulation of hydrolase activity,GO:0051346,2.0400237765008917,0.00017787777667978416,symptomatic
1244,regulation of glucose metabolic process,GO:0010906,2.0400237765008917,0.015115002414763126,symptomatic
1981,translation,GO:0006412,2.039509916607566,1.6341998103813835e-08,symptomatic
519,response to organic cyclic compound,GO:0014070,2.039302069976186,1.809584770859092e-18,symptomatic
2219,positive regulation of T cell proliferation,GO:0042102,2.0380431708926383,0.011900735295234574,symptomatic
2076,glucose homeostasis,GO:0042593,2.0380431708926383,0.00011001528225342562,symptomatic
2038,negative regulation of cellular response to growth factor stimulus,GO:0090288,2.0380431708926383,0.011907339476863451,symptomatic
351,cell activation,GO:0001775,2.037252005065428,7.412934079649276e-16,symptomatic
1790,neural tube development,GO:0021915,2.0362459546925566,0.000831288644782536,symptomatic
601,negative regulation of signal transduction,GO:0009968,2.036103669320836,9.686509268769472e-29,symptomatic
147,negative regulation of catalytic activity,GO:0043086,2.030813736877863,2.203892346625759e-09,symptomatic
1515,angiogenesis,GO:0001525,2.0286236436322103,3.6172135808581644e-07,symptomatic
681,positive regulation of phosphorus metabolic process,GO:0010562,2.0277836338418864,6.642875319649356e-15,symptomatic
680,positive regulation of phosphate metabolic process,GO:0045937,2.0277836338418864,6.616926587931976e-15,symptomatic
2225,positive regulation of inflammatory response,GO:0050729,2.0271844660194174,0.0023677363840391946,symptomatic
917,reproductive system development,GO:0061458,2.025356938892062,1.6838522090795714e-06,symptomatic
2215,stem cell development,GO:0048864,2.0230235783633845,0.0347037345947806,symptomatic
325,positive regulation of organelle organization,GO:0010638,2.023023578363384,1.29603151670175e-10,symptomatic
114,response to abiotic stimulus,GO:0009628,2.0225955158203535,1.0799444019008664e-23,symptomatic
189,regulation of DNA-binding transcription factor activity,GO:0051090,2.0210727359541623,9.523955361114599e-08,symptomatic
2132,response to fibroblast growth factor,GO:0071774,2.0204916339599257,0.020967996810526784,symptomatic
2050,positive regulation of cell division,GO:0051781,2.0204916339599257,0.020957486536436292,symptomatic
1874,embryonic skeletal system morphogenesis,GO:0048704,2.0204916339599257,0.02094698679368257,symptomatic
2126,B cell activation,GO:0042113,2.019940640877308,0.0002696457825429148,symptomatic
2235,chromosome localization,GO:0050000,2.0184466019417475,0.012870600610373442,symptomatic
1812,wound healing,GO:0042060,2.0178496050171866,8.179987758847579e-07,symptomatic
2196,positive regulation of tumor necrosis factor superfamily cytokine production,GO:1903557,2.017564799144919,0.010227101378551314,symptomatic
1796,negative regulation of binding,GO:0051100,2.017564799144919,0.010232945436481915,symptomatic
1073,DNA damage response,GO:0006974,2.0172111712880922,3.801254066664177e-16,symptomatic
2188,striated muscle cell differentiation,GO:0051146,2.01715355479124,7.996718317884952e-05,symptomatic
1957,cell growth,GO:0016049,2.016760347470618,0.011584633271201128,symptomatic
534,cellular response to organic substance,GO:0071310,2.016607851414099,7.505793354144493e-38,symptomatic
1051,negative regulation of DNA-templated transcription,GO:0045892,2.0164175592278557,3.282943933636585e-27,symptomatic
1414,positive regulation of cell adhesion,GO:0045785,2.0156778137360662,4.4576726368294914e-10,symptomatic
750,regulation of synapse structure or activity,GO:0050803,2.0153460695270904,3.265192440902161e-05,symptomatic
2259,epithelial tube formation,GO:0072175,2.0141428778437906,0.004203603454316129,symptomatic
1492,vesicle-mediated transport to the plasma membrane,GO:0098876,2.0141428778437906,0.004200696397985344,symptomatic
1970,regulation of mRNA processing,GO:0050684,2.0141428778437906,0.004197793359700627,symptomatic
1993,skeletal muscle tissue development,GO:0007519,2.013106796116505,0.00256183488589751,symptomatic
1135,phagocytosis,GO:0006909,2.011797032423521,0.0017739002113585252,symptomatic
139,regulation of catalytic activity,GO:0050790,2.009162621359223,6.96649079669697e-30,symptomatic
806,intracellular signaling cassette,GO:0141124,2.008846517822719,3.8279553017002196e-17,symptomatic
2226,positive regulation of canonical NF-kappaB signal transduction,GO:0043123,2.008788962698007,0.00018708838402043453,symptomatic
1649,regulation of cell projection organization,GO:0031344,2.0081484049930656,1.1350918050267726e-13,symptomatic
144,negative regulation of proteolysis,GO:0045861,2.008148404993065,8.623047959416872e-05,symptomatic
2228,positive regulation of DNA-binding transcription factor activity,GO:0051091,2.007953533726205,6.730345741455433e-05,symptomatic
2171,response to molecule of bacterial origin,GO:0002237,2.0051207148380445,5.977547634088176e-07,symptomatic
522,response to oxygen-containing compound,GO:1901700,2.00050980245155,1.0059651511442091e-32,symptomatic
1115,positive regulation of RNA biosynthetic process,GO:1902680,2.000389708964439,1.528219479462427e-36,symptomatic
2229,integrin-mediated signaling pathway,GO:0007229,1.999223300970874,0.017721300678216027,symptomatic
2212,regulation of lymphocyte differentiation,GO:0045619,1.999223300970874,0.00015489949118616665,symptomatic
2230,positive regulation of interleukin-6 production,GO:0032755,1.999223300970874,0.017712147113816124,symptomatic
854,response to starvation,GO:0042594,1.999223300970874,0.00015473592255767018,symptomatic
60,negative regulation of RNA metabolic process,GO:0051253,1.9992233009708738,2.381988713519143e-29,symptomatic
1166,negative regulation of lymphocyte proliferation,GO:0050672,1.9992233009708738,0.028812712364558665,symptomatic
725,macromolecule catabolic process,GO:0009057,1.9992233009708738,2.1617096272328427e-19,symptomatic
2231,response to unfolded protein,GO:0006986,1.9992233009708735,0.009266013817690025,symptomatic
1142,embryonic organ development,GO:0048568,1.9992233009708735,3.001106660490332e-09,symptomatic
1460,mRNA destabilization,GO:0061157,1.9992233009708735,0.04858042919527848,symptomatic
1114,positive regulation of DNA-templated transcription,GO:0045893,1.9980548478434799,2.3957194695866563e-36,symptomatic
1052,negative regulation of RNA biosynthetic process,GO:1902679,1.9930433216788466,1.4126672934826454e-26,symptomatic
1373,intracellular protein transport,GO:0006886,1.9921713669286485,3.401034686168793e-11,symptomatic
1187,phospholipid biosynthetic process,GO:0008654,1.9909277686017,6.529148453787718e-05,symptomatic
488,regulation of muscle system process,GO:0090257,1.9903771801701176,0.00010219771648116532,symptomatic
1309,regulation of innate immune response,GO:0045088,1.989967637540453,1.2224868620125706e-08,symptomatic
584,regulation of cell motility,GO:2000145,1.9892271844660196,4.7407685934624604e-20,symptomatic
603,negative regulation of signaling,GO:0023057,1.9877828242843452,1.347543610146982e-28,symptomatic
107,intracellular signal transduction,GO:0035556,1.9873388824049967,4.374173224978699e-31,symptomatic
1144,chordate embryonic development,GO:0043009,1.9871797871096033,4.076577616969805e-13,symptomatic
895,T cell activation,GO:0042110,1.986805764939999,2.1447720601608787e-06,symptomatic
826,renal system development,GO:0072001,1.9866099047502372,2.816273633658727e-06,symptomatic
827,kidney development,GO:0001822,1.9861990449384903,3.3943912910150703e-06,symptomatic
2154,regulation of cold-induced thermogenesis,GO:0120161,1.9859834115604706,0.003281181378664431,symptomatic
657,response to radiation,GO:0009314,1.9852100535341621,1.700057757906204e-08,symptomatic
1435,developmental growth involved in morphogenesis,GO:0060560,1.985044412311506,0.003807149205338309,symptomatic
1586,small GTPase-mediated signal transduction,GO:0007264,1.983962054398577,2.542973736963693e-05,symptomatic
419,positive regulation of intracellular signal transduction,GO:1902533,1.983888894060263,8.543184637662088e-21,symptomatic
315,regulation of protein-containing complex disassembly,GO:0043244,1.9833564493758669,0.007783184351492932,symptomatic
143,negative regulation of peptidase activity,GO:0010466,1.9833564493758669,0.007778397645249702,symptomatic
749,regulation of synapse organization,GO:0050807,1.9827007943512798,6.875241594474425e-05,symptomatic
20,positive regulation of biosynthetic process,GO:0009891,1.982415958625785,0.00879695978193596,asymptomatic
602,negative regulation of cell communication,GO:0010648,1.9820503019646816,3.592122397524323e-28,symptomatic
1647,regulation of neuron projection development,GO:0010975,1.9818008756900816,5.154461796433656e-09,symptomatic
2233,positive regulation of plasma membrane bounded cell projection assembly,GO:0120034,1.9812122802414065,0.016481895287247608,symptomatic
866,positive regulation of RNA metabolic process,GO:0051254,1.9808718991801046,2.098618178184998e-38,symptomatic
1254,response to ketone,GO:1901654,1.9807972797637687,0.00017878038785117752,symptomatic
21,positive regulation of cellular metabolic process,GO:0031325,1.9797665369649804,0.0028618181157779314,asymptomatic
350,leukocyte activation,GO:0045321,1.9795909935963643,6.772502678726887e-12,symptomatic
1630,negative regulation of cell motility,GO:2000146,1.9794290108622514,6.911395379299625e-06,symptomatic
53,negative regulation of macromolecule biosynthetic process,GO:0010558,1.9788527578751005,4.205986514598316e-43,symptomatic
1629,negative regulation of cell migration,GO:0030336,1.9783980582524272,1.0120147867680834e-05,symptomatic
1919,regulation of non-canonical NF-kappaB signal transduction,GO:1901222,1.978398058252427,0.024395645196000116,symptomatic
2234,establishment of chromosome localization,GO:0051303,1.978398058252427,0.02440759798639502,symptomatic
1167,negative regulation of mononuclear cell proliferation,GO:0032945,1.9772538141470182,0.030883952953420012,symptomatic
382,tube development,GO:0035295,1.9771324357667759,1.0513281656620316e-17,symptomatic
2236,pyrimidine-containing compound metabolic process,GO:0072527,1.975976518401445,0.039378966908114155,symptomatic
1690,immune system development,GO:0002520,1.9752805069472703,0.0016182045585113544,symptomatic
2161,regulation of pattern recognition receptor signaling pathway,GO:0062207,1.9745415318230852,0.0020546252800561007,symptomatic
2128,hexose metabolic process,GO:0019318,1.9745415318230852,0.002056206977731279,symptomatic
476,protein-DNA complex organization,GO:0071824,1.9735323473369024,1.3417759021050278e-16,symptomatic
1982,peptide biosynthetic process,GO:0043043,1.9710652263093122,3.7890941627935834e-08,symptomatic
553,response to lipid,GO:0033993,1.9710652263093122,1.8978332836246145e-16,symptomatic
865,positive regulation of mRNA metabolic process,GO:1903313,1.9689320388349516,0.00648894552902086,symptomatic
1933,positive regulation of cell-substrate adhesion,GO:0010811,1.9677394694595214,0.008173514091913959,symptomatic
1451,mRNA catabolic process,GO:0006402,1.9677394694595214,0.008178405482752926,symptomatic
935,regulation of protein transport,GO:0051223,1.9675613934894347,1.7980138888421158e-08,symptomatic
2237,Notch signaling pathway,GO:0007219,1.9650485436893204,0.01332867534862656,symptomatic
1325,nuclear chromosome segregation,GO:0098813,1.9650485436893204,0.00013249205483529278,symptomatic
62,negative regulation of nitrogen compound metabolic process,GO:0051172,1.9645018725262242,5.883752176872326e-45,symptomatic
2009,regulation of proteolysis involved in protein catabolic process,GO:1903050,1.9643023699495485,0.00017019799867185623,symptomatic
1452,RNA catabolic process,GO:0006401,1.9635228848821085,0.0017415094922211825,symptomatic
54,negative regulation of cellular biosynthetic process,GO:0031327,1.9632694507877722,4.581660889649709e-43,symptomatic
264,endosomal transport,GO:0016197,1.9615021066129326,4.264227160553265e-05,symptomatic
272,positive regulation of nucleobase-containing compound metabolic process,GO:0045935,1.9613555453915323,1.0712659541468284e-41,symptomatic
292,protein localization to organelle,GO:0033365,1.9613489759186515,6.422090333396161e-14,symptomatic
211,regulation of cellular localization,GO:0060341,1.961200034986443,6.475452959867966e-19,symptomatic
55,negative regulation of biosynthetic process,GO:0009890,1.95974639516891,4.726410079925729e-43,symptomatic
405,regulation of intracellular signal transduction,GO:1902531,1.9588122741123946,3.2452987242058536e-35,symptomatic
2280,negative regulation of cell-cell adhesion,GO:0022408,1.9580022019817835,0.0007210780037270341,symptomatic
1326,chromosome segregation,GO:0007059,1.9570710024564273,3.2879167250468823e-06,symptomatic
2012,regulation of proteasomal protein catabolic process,GO:0061136,1.956911696717522,0.0009252041920008436,symptomatic
2100,positive regulation of hemopoiesis,GO:1903708,1.956911696717522,0.0009259929423776559,symptomatic
2099,positive regulation of leukocyte differentiation,GO:1902107,1.956911696717522,0.0009267830387448724,symptomatic
23,positive regulation of nitrogen compound metabolic process,GO:0051173,1.9565043362241497,0.007791930964043715,asymptomatic
2279,negative regulation of leukocyte cell-cell adhesion,GO:1903038,1.9557619248628113,0.007846792899781695,symptomatic
2129,monosaccharide metabolic process,GO:0005996,1.955761924862811,0.0012190335708556317,symptomatic
1145,embryo development ending in birth or egg hatching,GO:0009792,1.9554446885408545,9.904437806646697e-13,symptomatic
2238,negative regulation of innate immune response,GO:0045824,1.9532641446267158,0.042278624996945735,symptomatic
2241,regulation of transcription elongation by RNA polymerase II,GO:0034243,1.9532641446267158,0.042260049151165,symptomatic
1600,muscle structure development,GO:0061061,1.952819665358397,1.7646249995072878e-09,symptomatic
1631,negative regulation of locomotion,GO:0040013,1.9519044062733382,2.6261495895654105e-06,symptomatic
1727,protein ubiquitination,GO:0016567,1.9512419417475728,1.3886128797681034e-11,symptomatic
1728,protein modification by small protein conjugation,GO:0032446,1.9508090614886733,5.136603459338596e-13,symptomatic
2244,response to interleukin-1,GO:0070555,1.9504617570447549,0.010992197203079701,symptomatic
1884,protein targeting,GO:0006605,1.9504617570447549,9.169727258240877e-05,symptomatic
2242,negative regulation of inflammatory response,GO:0050728,1.9504617570447549,0.0023398165903327946,symptomatic
1648,regulation of plasma membrane bounded cell projection organization,GO:0120035,1.9504617570447549,3.952695264221507e-12,symptomatic
328,regulation of cellular component biogenesis,GO:0044087,1.9499611251769304,5.050287987493571e-18,symptomatic
585,regulation of locomotion,GO:0040012,1.9474200100627994,2.080472469524797e-19,symptomatic
511,positive regulation of cell population proliferation,GO:0008284,1.9466121614716403,1.471211426492674e-17,symptomatic
18,positive regulation of metabolic process,GO:0009893,1.9463296585103522,0.002045130332628606,asymptomatic
177,positive regulation of catalytic activity,GO:0043085,1.9449457452884067,4.1360606517642583e-16,symptomatic
2139,negative regulation of Wnt signaling pathway,GO:0030178,1.942102635228849,0.0021326584221583104,symptomatic
258,negative regulation of organelle organization,GO:0010639,1.9412747994934567,2.310669448037503e-06,symptomatic
535,response to cytokine,GO:0034097,1.9409934960882271,5.505004259338537e-15,symptomatic
187,maintenance of location,GO:0051235,1.940422615648201,0.002811162073569108,symptomatic
1015,regulation of lymphocyte proliferation,GO:0050670,1.9401745114907214,0.00016034380529027253,symptomatic
1877,embryonic organ morphogenesis,GO:0048562,1.940035769034236,1.2368230893584377e-05,symptomatic
294,regulation of leukocyte cell-cell adhesion,GO:1903037,1.939947138408395,9.176198582288676e-07,symptomatic
1909,maintenance of location in cell,GO:0051651,1.938022587675847,0.039459383940729786,symptomatic
2245,DNA replication,GO:0006260,1.938022587675847,0.0008145111767665751,symptomatic
2243,cellular response to interleukin-1,GO:0071347,1.938022587675847,0.03947688255888532,symptomatic
483,regulation of steroid metabolic process,GO:0019218,1.938022587675847,0.03949439670376504,symptomatic
14,regulation of developmental process,GO:0050793,1.937254901960784,0.035549997317452516,asymptomatic
1417,response to nutrient,GO:0007584,1.936747572815534,0.0032055116066159036,symptomatic
2240,negative regulation of defense response,GO:0031348,1.936006753904601,0.00011002404081763324,symptomatic
167,sensory organ morphogenesis,GO:0090596,1.93586763298236,3.527951231100757e-05,symptomatic
8,regulation of multicellular organismal process,GO:0051239,1.9355360755225892,0.009098769452075514,asymptomatic
57,negative regulation of cellular metabolic process,GO:0031324,1.9354844554500295,3.901909123499388e-51,symptomatic
2247,regulation of calcium-mediated signaling,GO:0050848,1.9347322267460068,0.03560602954864506,symptomatic
2246,positive regulation of neuron differentiation,GO:0045666,1.9347322267460068,0.035622046655954386,symptomatic
154,positive regulation of nitrogen compound metabolic process,GO:0051173,1.9338717721199248,3.3622568079405246e-61,symptomatic
1730,post-translational protein modification,GO:0043687,1.9321197411003235,2.2600394745972858e-15,symptomatic
800,cellular component disassembly,GO:0022411,1.932022517744962,2.17617391936582e-06,symptomatic
621,regulation of microtubule-based process,GO:0032886,1.9310679611650488,6.95450584859014e-05,symptomatic
1964,nuclear division,GO:0000280,1.930714091280283,9.07357527653836e-06,symptomatic
42,positive regulation of gene expression,GO:0010628,1.9298175809541034,2.2325520735097897e-21,symptomatic
210,regulation of protein localization,GO:0032880,1.9296655879180151,6.257180011554864e-16,symptomatic
2137,regulation of response to cytokine stimulus,GO:0060759,1.9290751149718957,0.002916140218588322,symptomatic
61,negative regulation of nucleobase-containing compound metabolic process,GO:0045934,1.9288464702978443,3.985748631717808e-28,symptomatic
2054,regulation of protein localization to cell periphery,GO:1904375,1.9278224687933425,0.008309806003620959,symptomatic
1306,positive regulation of innate immune response,GO:0045089,1.9278224687933425,4.8522416259058486e-05,symptomatic
1182,glycerolipid biosynthetic process,GO:0045017,1.9275022856894073,0.00035798491030475935,symptomatic
259,negative regulation of cellular component organization,GO:0051129,1.9266258068015403,1.3342926617693136e-12,symptomatic
2248,mRNA transport,GO:0051028,1.9251779935275082,0.010733304551217368,symptomatic
3,hindbrain development,GO:0030902,1.9247180847856242,0.0034124250889543085,symptomatic
1994,skeletal muscle organ development,GO:0060538,1.9223300970873785,0.0043413987208572756,symptomatic
936,regulation of establishment of protein localization,GO:0070201,1.9216194390108214,1.8633958796617603e-09,symptomatic
138,regulation of hydrolase activity,GO:0051336,1.921296586282493,5.785032355267873e-13,symptomatic
1020,regulation of T cell activation,GO:0050863,1.9203065917220237,1.2895696039167629e-06,symptomatic
1146,placenta development,GO:0001890,1.919783964508455,0.005414385023673106,symptomatic
2221,positive regulation of leukocyte cell-cell adhesion,GO:1903039,1.9195441114394258,6.616677847025372e-05,symptomatic
2254,negative regulation of neuron projection development,GO:0010977,1.9170634392871393,0.006961438559596906,symptomatic
16,positive regulation of macromolecule biosynthetic process,GO:0010557,1.9170506912442398,0.03353906690732562,asymptomatic
492,regulation of response to stress,GO:0080134,1.9166595068304837,4.790835272133592e-24,symptomatic
385,eye morphogenesis,GO:0048592,1.9128371089536138,0.005049868128755831,symptomatic
64,embryonic morphogenesis,GO:0048598,1.9120088616667752,3.3764021949916063e-10,symptomatic
2211,regulation of T cell differentiation,GO:0045580,1.911825561037721,0.0019509513152746742,symptomatic
533,cellular response to cytokine stimulus,GO:0071345,1.9112244761688546,2.0891065022879737e-12,symptomatic
178,positive regulation of molecular function,GO:0044093,1.9106604968261427,3.589112057586538e-21,symptomatic
1006,mitochondrial transport,GO:0006839,1.9093705683429694,0.002484049199615261,symptomatic
295,regulation of cell-cell adhesion,GO:0022407,1.9089093120153109,2.5735573740190067e-08,symptomatic
1016,regulation of mononuclear cell proliferation,GO:0032944,1.9079724449099624,0.00027752429418746374,symptomatic
614,peptidyl-lysine modification,GO:0018205,1.9076558215370933,0.014406730776426234,symptomatic
2031,sex differentiation,GO:0007548,1.9073861882054273,5.6927802631071895e-05,symptomatic
2271,DNA-templated transcription initiation,GO:0006352,1.907153806847215,0.005824987037136322,symptomatic
1413,positive regulation of cell-cell adhesion,GO:0022409,1.9069514563106795,1.150847186374003e-05,symptomatic
232,regulation of developmental process,GO:0050793,1.9069388920616792,1.5833754339062503e-45,symptomatic
140,regulation of molecular function,GO:0065009,1.9066297915135573,2.04279451382201e-36,symptomatic
2152,vacuole organization,GO:0007033,1.9064758282454208,0.0018046107182451648,symptomatic
261,regulation of organelle organization,GO:0033043,1.9064323460734913,1.910104341650329e-20,symptomatic
19,positive regulation of cellular biosynthetic process,GO:0031328,1.9049888309754281,0.032554448214539525,asymptomatic
2256,neural tube formation,GO:0001841,1.9040221914008322,0.03329246355338601,symptomatic
347,regulation of cell morphogenesis,GO:0022604,1.9020950434338273,0.0002274191081395559,symptomatic
17,positive regulation of macromolecule metabolic process,GO:0010604,1.9014356870788165,0.009116614943385245,asymptomatic
1307,positive regulation of response to external stimulus,GO:0032103,1.9014352047277332,2.8650071221649254e-09,symptomatic
704,protein-containing complex localization,GO:0031503,1.9011019119661683,0.005217764491841847,symptomatic
1810,platelet activation,GO:0030168,1.8992621359223303,0.04278005164371929,symptomatic
171,regulation of cell population proliferation,GO:0042127,1.8966378571263063,3.368559388678151e-29,symptomatic
2220,positive regulation of T cell activation,GO:0050870,1.8964964119881806,0.000190569332002428,symptomatic
624,regulation of protein-containing complex assembly,GO:0043254,1.894998389545852,6.176670866924628e-07,symptomatic
2261,positive regulation of leukocyte migration,GO:0002687,1.8946887492861224,0.006198496658459163,symptomatic
121,regulation of viral process,GO:0050792,1.892755787901419,0.004309403319779991,symptomatic
2266,inner ear development,GO:0048839,1.8924686586860213,0.0011762567754459053,symptomatic
1001,cell morphogenesis involved in neuron differentiation,GO:0048667,1.8923605855514953,1.7640478103991793e-07,symptomatic
1729,protein modification by small protein conjugation or removal,GO:0070647,1.890489277185066,2.533990352729938e-13,symptomatic
2252,establishment of RNA localization,GO:0051236,1.8895098271371065,0.005404468225251235,symptomatic
