,pathway,pthwy_id,fold_enrichment,q-value,cohort
0,cochlear nucleus development,GO:0021747,9.996116504854369,0.00894936918670939,symptomatic
94,positive regulation of macrophage apoptotic process,GO:2000111,9.996116504854369,0.008923170799160475,symptomatic
119,positive regulation of viral translation,GO:1904973,9.996116504854369,0.008912734342085433,symptomatic
122,regulation of viral translation,GO:1904971,9.996116504854369,0.008907525262984273,symptomatic
123,sphingolipid translocation,GO:0099039,9.996116504854369,0.008902322269255894,symptomatic
88,regulation of mast cell apoptotic process,GO:0033025,9.996116504854369,0.00892839819857416,symptomatic
134,negative regulation of metalloendopeptidase activity,GO:1904684,9.996116504854369,0.008897125350242901,symptomatic
150,positive regulation of heparan sulfate proteoglycan biosynthetic process,GO:0010909,9.996116504854369,0.00889193449531277,symptomatic
83,viral penetration into host nucleus,GO:0075732,9.996116504854369,0.0012657282783194138,symptomatic
156,positive regulation of B cell apoptotic process,GO:0002904,9.996116504854369,0.008886749693857778,symptomatic
160,fungiform papilla formation,GO:0061198,9.996116504854369,0.008881570935294925,symptomatic
77,osteoblast fate commitment,GO:0002051,9.996116504854369,0.008933631726240381,symptomatic
169,regulation of cell proliferation involved in heart valve morphogenesis,GO:0003250,9.996116504854369,0.008876398209065864,symptomatic
172,positive regulation of calcidiol 1-monooxygenase activity,GO:0060559,9.996116504854369,0.00887123150463684,symptomatic
63,apoptotic process involved in embryonic digit morphogenesis,GO:1902263,9.996116504854369,0.008938871392941989,symptomatic
99,intrinsic apoptotic signaling pathway in response to hypoxia,GO:1990144,9.996116504854369,0.008917949517241714,symptomatic
15,negative regulation of primary miRNA processing,GO:2000635,9.996116504854369,0.0012667812968537894,symptomatic
13,central nervous system morphogenesis,GO:0021551,9.996116504854369,0.008944117209487143,symptomatic
16,regulation of primary miRNA processing,GO:2000634,8.33009708737864,0.0007402360967473025,symptomatic
180,cytoplasmic sequestering of NF-kappaB,GO:0007253,8.33009708737864,0.0007408917531660334,symptomatic
193,maintenance of DNA repeat elements,GO:0043570,8.33009708737864,0.0007395815997563676,symptomatic
209,regulation of protein localization to endoplasmic reticulum,GO:1905550,7.996893203883494,0.004676312075540983,symptomatic
314,regulation of termination of DNA-templated transcription,GO:0031554,7.996893203883494,0.0046700769927735955,symptomatic
338,cranial ganglion development,GO:0061550,7.996893203883494,0.004663858514753923,symptomatic
227,glial cell apoptotic process,GO:0034349,7.996893203883494,0.004654561786817537,symptomatic
213,hair follicle placode formation,GO:0060789,7.996893203883494,0.0046607554818099755,symptomatic
162,fungiform papilla morphogenesis,GO:0061197,7.996893203883494,0.004657656575239623,symptomatic
151,positive regulation of sulfur metabolic process,GO:0051176,7.996893203883494,0.004673192454409869,symptomatic
135,regulation of metalloendopeptidase activity,GO:1904683,7.996893203883494,0.004666965682318717,symptomatic
270,positive regulation of endodeoxyribonuclease activity,GO:0032079,7.497087378640777,0.027152185623523045,symptomatic
307,regulation of epithelial to mesenchymal transition involved in endocardial cushion formation,GO:1905005,7.497087378640777,0.02706098346451889,symptomatic
306,positive regulation of epithelial to mesenchymal transition involved in endocardial cushion formation,GO:1905007,7.497087378640777,0.027073974815197965,symptomatic
303,hepatocyte growth factor receptor signaling pathway,GO:0048012,7.497087378640777,0.000339522379999053,symptomatic
297,establishment or maintenance of microtubule cytoskeleton polarity,GO:0030951,7.497087378640777,0.027099994973597965,symptomatic
293,regulation of leukocyte adhesion to arterial endothelial cell,GO:1904997,7.497087378640777,0.02711302381733527,symptomatic
291,protein localization to lipid droplet,GO:1990044,7.497087378640777,0.027126065194832787,symptomatic
278,anterograde neuronal dense core vesicle transport,GO:1990048,7.497087378640777,0.02713911912418545,symptomatic
250,endoplasmic reticulum tubular network membrane organization,GO:1990809,7.497087378640777,0.027230849608912294,symptomatic
262,synaptic vesicle recycling via endosome,GO:0036466,7.497087378640777,0.02716526471101029,symptomatic
257,negative regulation of lysosome organization,GO:1905672,7.497087378640777,0.02717835640484692,symptomatic
254,positive regulation of fibroblast growth factor production,GO:0090271,7.497087378640777,0.027191460723267773,symptomatic
252,regulation of Schwann cell differentiation,GO:0014038,7.497087378640777,0.027217707306977493,symptomatic
248,neuropilin signaling pathway,GO:0038189,7.497087378640777,0.027244004608723362,symptomatic
245,regulation of ureteric bud formation,GO:0072106,7.497087378640777,0.02725717232482231,symptomatic
238,positive regulation of ureteric bud formation,GO:0072107,7.497087378640777,0.027270352775656367,symptomatic
228,negative regulation of epithelial cell differentiation involved in kidney development,GO:2000697,7.497087378640777,0.02728354597970845,symptomatic
155,regulation of heparan sulfate proteoglycan biosynthetic process,GO:0010908,7.497087378640777,0.027022084111191835,symptomatic
313,regulation of termination of RNA polymerase II transcription,GO:1904594,7.497087378640777,0.02704800457556708,symptomatic
301,negative regulation of myofibroblast differentiation,GO:1904761,7.497087378640777,0.027086978645560693,symptomatic
316,negative regulation of hyaluronan biosynthetic process,GO:1900126,7.497087378640777,0.027035038130420595,symptomatic
373,vasculogenesis involved in coronary vascular morphogenesis,GO:0060979,7.497087378640777,0.026931752406904184,symptomatic
331,negative regulation of triglyceride biosynthetic process,GO:0010868,7.497087378640777,0.02699621327910836,symptomatic
425,negative regulation of bicellular tight junction assembly,GO:1903347,7.497087378640777,0.02685480454288446,symptomatic
420,cardiac muscle tissue regeneration,GO:0061026,7.497087378640777,0.026867598637473733,symptomatic
401,positive regulation of oxidative stress-induced neuron intrinsic apoptotic signaling pathway,GO:1903378,7.497087378640777,0.02688040492853068,symptomatic
397,formation of radial glial scaffolds,GO:0021943,7.497087378640777,0.02689322343350375,symptomatic
390,actin modification,GO:0030047,7.497087378640777,0.026906054169874696,symptomatic
384,retinal cell programmed cell death,GO:0046666,7.497087378640777,0.026918897155158647,symptomatic
323,positive regulation of stress granule assembly,GO:0062029,7.497087378640777,0.027009142500027474,symptomatic
369,negative regulation of long-chain fatty acid import into cell,GO:0140213,7.497087378640777,0.027204577684542867,symptomatic
337,trigeminal ganglion development,GO:0061551,7.497087378640777,0.026983296430649457,symptomatic
348,Langerhans cell differentiation,GO:0061520,7.497087378640777,0.02695749978014214,symptomatic
359,negative regulation of long-chain fatty acid import across plasma membrane,GO:0010748,7.497087378640777,0.026944619942693437,symptomatic
340,negative regulation of dendrite extension,GO:1903860,7.497087378640777,0.02697039193689974,symptomatic
429,CRD-mediated mRNA stabilization,GO:0070934,7.269902912621359,2.4227316126345384e-05,symptomatic
541,corticosteroid receptor signaling pathway,GO:0031958,7.140083217753121,0.0020588375067446723,symptomatic
481,regulation of vitamin D biosynthetic process,GO:0060556,7.140083217753121,0.0020478444765789877,symptomatic
470,random inactivation of X chromosome,GO:0060816,7.140083217753121,0.0020494077166374448,symptomatic
465,glutathione transmembrane transport,GO:0034775,7.140083217753121,0.002050973345145189,symptomatic
460,negative regulation of hepatocyte apoptotic process,GO:1903944,7.140083217753121,0.0020525413675803153,symptomatic
457,post-embryonic camera-type eye development,GO:0031077,7.140083217753121,0.0020541117894376836,symptomatic
451,positive regulation of receptor binding,GO:1900122,7.140083217753121,0.0020556846162289835,symptomatic
448,negative regulation of hydrogen peroxide-mediated programmed cell death,GO:1901299,7.140083217753121,0.002057259853482799,symptomatic
444,odontoblast differentiation,GO:0071895,7.140083217753121,0.0020604175815771703,symptomatic
450,regulation of hydrogen peroxide-mediated programmed cell death,GO:1901298,6.997281553398058,0.00014722958148482665,symptomatic
540,glucocorticoid receptor signaling pathway,GO:0042921,6.6640776699029125,0.010872632315073046,symptomatic
568,intestinal epithelial cell maturation,GO:0060574,6.6640776699029125,0.010836085651829103,symptomatic
565,negative regulation of sequestering of triglyceride,GO:0010891,6.6640776699029125,0.010854328220266527,symptomatic
563,"negative regulation of nuclear-transcribed mRNA catabolic process, deadenylation-dependent decay",GO:1900152,6.6640776699029125,6.023336319707194e-05,symptomatic
555,pyrimidine deoxyribonucleoside triphosphate metabolic process,GO:0009211,6.6640776699029125,0.010860422733585036,symptomatic
509,positive regulation of cell proliferation in bone marrow,GO:0071864,6.6640776699029125,0.010909426333059757,symptomatic
512,negative regulation of cytoplasmic translation,GO:2000766,6.6640776699029125,0.0008417478399862092,symptomatic
499,activation-induced cell death of T cells,GO:0006924,6.6640776699029125,0.010915582894195796,symptomatic
496,negative regulation of cardiac muscle adaptation,GO:0010616,6.6640776699029125,0.010848240543194027,symptomatic
539,positive regulation of cell proliferation involved in heart morphogenesis,GO:2000138,6.6640776699029125,0.010878747406363864,symptomatic
536,hair follicle maturation,GO:0048820,6.6640776699029125,0.010884869380143472,symptomatic
486,negative regulation of cardiac muscle hypertrophy in response to stress,GO:1903243,6.6640776699029125,0.010921746407970044,symptomatic
163,fungiform papilla development,GO:0061196,6.6640776699029125,0.010842159690871609,symptomatic
532,interleukin-11-mediated signaling pathway,GO:0038154,6.6640776699029125,0.010890998248037697,symptomatic
518,response to indole-3-methanol,GO:0071680,6.6640776699029125,0.01090327671280437,symptomatic
302,regulation of myofibroblast differentiation,GO:1904760,6.6640776699029125,0.01086652409467132,symptomatic
525,modulation by host of viral RNA genome replication,GO:0044830,6.6640776699029125,0.010897134021698564,symptomatic
581,positive regulation of fibroblast migration,GO:0010763,6.426074895977809,2.4275758459809546e-05,symptomatic
578,interleukin-6-mediated signaling pathway,GO:0070102,6.426074895977809,2.4307041653701053e-05,symptomatic
35,negative regulation of miRNA-mediated gene silencing,GO:0060965,6.426074895977809,2.4244555685439612e-05,symptomatic
589,somatic stem cell division,GO:0048103,6.361165048543689,0.0003331628580409659,symptomatic
34,negative regulation of miRNA processing,GO:1903799,6.361165048543689,0.00033284343056441657,symptomatic
24,regulation of epithelial cell differentiation,GO:0030856,6.359235668789809,0.030364317973533873,asymptomatic
592,regulation of transforming growth factor beta2 production,GO:0032909,6.247572815533981,0.004473295461356313,symptomatic
277,regulation of endodeoxyribonuclease activity,GO:0032071,6.247572815533981,0.004455086660292447,symptomatic
330,regulation of stress granule assembly,GO:0062028,6.247572815533981,0.004446037736811827,symptomatic
631,necroptotic signaling pathway,GO:0097527,6.247572815533981,0.004443029592199639,symptomatic
634,positive regulation of aspartic-type endopeptidase activity involved in amyloid precursor protein catabolic process,GO:1902961,6.247572815533981,0.00444002551539626,symptomatic
594,negative regulation of stress-activated MAPK cascade,GO:0032873,6.247572815533981,0.004470250331702565,symptomatic
605,positive regulation of cell migration by vascular endothelial growth factor signaling pathway,GO:0038089,6.247572815533981,0.004467209345082359,symptomatic
610,internal peptidyl-lysine acetylation,GO:0018393,6.247572815533981,0.004464172493046273,symptomatic
84,intracellular transport of virus,GO:0075733,6.247572815533981,0.004461139767167845,symptomatic
617,positive regulation of microtubule nucleation,GO:0090063,6.247572815533981,0.004458111159043494,symptomatic
461,regulation of hepatocyte apoptotic process,GO:1903943,6.247572815533981,0.004449049957500723,symptomatic
319,regulation of hyaluronan biosynthetic process,GO:1900125,6.247572815533981,0.004452066262556656,symptomatic
643,growth hormone receptor signaling pathway via JAK-STAT,GO:0060397,5.997669902912621,0.0017739201119937877,symptomatic
40,negative regulation of gene silencing by regulatory ncRNA,GO:0060967,5.997669902912621,5.058592194886931e-05,symptomatic
654,cellular response to X-ray,GO:0071481,5.997669902912621,0.0017725111206419262,symptomatic
757,foregut morphogenesis,GO:0007440,5.997669902912621,0.0017753313451775536,symptomatic
51,negative regulation of post-transcriptional gene silencing,GO:0060149,5.997669902912621,5.070536922619839e-05,symptomatic
39,negative regulation of post-transcriptional gene silencing by regulatory ncRNA,GO:1900369,5.997669902912621,5.064557515871467e-05,symptomatic
692,voluntary musculoskeletal movement,GO:0050882,5.712066574202497,0.021060651086552334,symptomatic
687,regulation of epithelial cell proliferation involved in lung morphogenesis,GO:2000794,5.712066574202497,0.021092723144044548,symptomatic
728,negative regulation of centriole replication,GO:0046600,5.712066574202497,0.020965017453969607,symptomatic
712,regulation of myosin-light-chain-phosphatase activity,GO:0035507,5.712066574202497,0.020996798683055967,symptomatic
690,regulation of mast cell proliferation,GO:0070666,5.712066574202497,0.021071330929902515,symptomatic
735,vascular endothelial growth factor production,GO:0010573,5.712066574202497,0.020954445080064426,symptomatic
696,positive regulation of pinocytosis,GO:0048549,5.712066574202497,0.021049982063712138,symptomatic
717,chaperone-mediated autophagy,GO:0061684,5.712066574202497,0.020986194239276647,symptomatic
689,dorsal root ganglion development,GO:1990791,5.712066574202497,0.021082021610232246,symptomatic
510,regulation of cell proliferation in bone marrow,GO:0071863,5.712066574202497,0.021103435547875957,symptomatic
271,positive regulation of nuclease activity,GO:0032075,5.712066574202497,0.0210393238449457,symptomatic
686,inflammatory cell apoptotic process,GO:0006925,5.712066574202497,0.021114158838296624,symptomatic
726,response to luteinizing hormone,GO:0034699,5.712066574202497,0.02097560050164955,symptomatic
662,positive regulation of cyclin-dependent protein serine/threonine kinase activity,GO:0045737,5.712066574202497,0.0002593574389322493,symptomatic
702,ribosomal large subunit export from nucleus,GO:0000055,5.712066574202497,0.02100741384922536,symptomatic
701,limb joint morphogenesis,GO:0036022,5.712066574202497,0.021018039754055518,symptomatic
700,post-embryonic eye morphogenesis,GO:0048050,5.712066574202497,0.02102867641385008,symptomatic
179,regulation of calcidiol 1-monooxygenase activity,GO:0060558,5.712066574202497,0.020943883363794234,symptomatic
574,intestinal epithelial cell development,GO:0060576,5.6228155339805825,9.901910211663434e-05,symptomatic
310,positive regulation of cardiac epithelial to mesenchymal transition,GO:0062043,5.553398058252427,0.00814652207034595,symptomatic
469,glutathione transport,GO:0034635,5.553398058252427,0.008136742331966183,symptomatic
635,positive regulation of aspartic-type peptidase activity,GO:1905247,5.553398058252427,0.008156325346002202,symptomatic
244,regulation of epithelial tube formation,GO:1905276,5.553398058252427,0.008161235836878784,symptomatic
759,positive regulation of vascular associated smooth muscle cell apoptotic process,GO:1905461,5.553398058252427,0.008171074578092621,symptomatic
755,cellular response to insulin-like growth factor stimulus,GO:1990314,5.553398058252427,0.008185877249429745,symptomatic
604,negative regulation of stress-activated protein kinase signaling cascade,GO:0070303,5.553398058252427,0.00817600284985263,symptomatic
466,tripeptide transmembrane transport,GO:0035443,5.553398058252427,0.008151420760706952,symptomatic
756,embryonic foregut morphogenesis,GO:0048617,5.553398058252427,0.008180937070039626,symptomatic
239,positive regulation of epithelial tube formation,GO:1905278,5.553398058252427,0.008166152244009434,symptomatic
497,negative regulation of muscle adaptation,GO:0014745,5.553398058252427,0.008117253128775844,symptomatic
746,negative regulation of synapse assembly,GO:0051964,5.553398058252427,0.00820073365097136,symptomatic
742,regulation of chronic inflammatory response,GO:0002676,5.553398058252427,0.00821066791341954,symptomatic
751,response to oxygen-glucose deprivation,GO:0090649,5.553398058252427,0.008195775529054207,symptomatic
770,mesenchymal-epithelial cell signaling,GO:0060638,5.553398058252427,0.008126986046196438,symptomatic
95,positive regulation of myeloid cell apoptotic process,GO:0033034,5.553398058252427,0.008190823398825172,symptomatic
639,regulation of aspartic-type endopeptidase activity involved in amyloid precursor protein catabolic process,GO:1902959,5.553398058252427,0.008122116671693026,symptomatic
830,regulation of attachment of mitotic spindle microtubules to kinetochore,GO:1902423,5.553398058252427,0.00820569777545742,symptomatic
765,coronary artery morphogenesis,GO:0060982,5.553398058252427,0.008141629264297694,symptomatic
768,regulation of branching involved in salivary gland morphogenesis,GO:0060693,5.553398058252427,0.00813186126278084,symptomatic
98,positive regulation of leukocyte apoptotic process,GO:2000108,5.5533980582524265,1.414291234285108e-07,symptomatic
772,fibroblast apoptotic process,GO:0044346,5.452427184466019,0.0032253513742210456,symptomatic
773,thymocyte apoptotic process,GO:0070242,5.452427184466019,0.003223037635789036,symptomatic
837,positive regulation of attachment of spindle microtubules to kinetochore,GO:0051987,5.452427184466019,0.003229988831265217,symptomatic
774,blood vessel endothelial cell differentiation,GO:0060837,5.452427184466019,0.003220727214544743,symptomatic
616,internal protein amino acid acetylation,GO:0006475,5.452427184466019,0.0032276684369898826,symptomatic
777,positive regulation of cytoplasmic translation,GO:2000767,5.33126213592233,0.0004707735494480454,symptomatic
159,positive regulation of lymphocyte apoptotic process,GO:0070230,5.292061679040548,0.00017843742414722088,symptomatic
780,regulation of establishment of endothelial barrier,GO:1903140,5.292061679040548,0.00017880609651116142,symptomatic
781,regulation of endothelial cell development,GO:1901550,5.292061679040548,0.00017862157009577322,symptomatic
784,negative regulation of anoikis,GO:2000811,5.2611139499233515,6.769400817978807e-05,symptomatic
785,regulation of anoikis,GO:2000209,5.197980582524273,3.550887969233144e-06,symptomatic
564,"regulation of nuclear-transcribed mRNA catabolic process, deadenylation-dependent decay",GO:1900151,5.183171521035598,1.330773374156969e-06,symptomatic
786,inflammatory response to wounding,GO:0090594,4.998058252427185,0.0020938497338833743,symptomatic
226,ectodermal placode development,GO:0071696,4.998058252427185,0.002095444440459066,symptomatic
471,dosage compensation by inactivation of X chromosome,GO:0009048,4.998058252427185,0.0020922574527169227,symptomatic
876,negative regulation of calcium ion-dependent exocytosis,GO:0045955,4.998058252427184,0.034664189970714965,symptomatic
879,epithelial to mesenchymal transition involved in endocardial cushion formation,GO:0003198,4.998058252427184,0.005337393408242153,symptomatic
889,T-helper 17 cell lineage commitment,GO:0072540,4.998058252427184,0.01344866699985592,symptomatic
224,ectodermal placode formation,GO:0060788,4.998058252427184,0.005340859248117635,symptomatic
225,ectodermal placode morphogenesis,GO:0071697,4.998058252427184,0.005354767735742941,symptomatic
364,regulation of long-chain fatty acid import into cell,GO:0140212,4.998058252427184,0.03485361177383363,symptomatic
875,endothelial cell activation,GO:0042118,4.998058252427184,0.013455940481197108,symptomatic
929,positive regulation of nucleocytoplasmic transport,GO:0046824,4.998058252427184,3.3728971008900144e-14,symptomatic
638,regulation of aspartic-type peptidase activity,GO:1905245,4.998058252427184,0.013477808206789519,symptomatic
919,type I pneumocyte differentiation,GO:0060509,4.998058252427184,0.03464849771631446,symptomatic
874,protein localization to cytoplasmic stress granule,GO:1903608,4.998058252427184,0.034679896445554435,symptomatic
860,anoikis,GO:0043276,4.998058252427184,0.005344329592008549,symptomatic
181,cytoplasmic sequestering of transcription factor,GO:0042994,4.998058252427184,0.01348511325188805,symptomatic
813,ubiquitin-dependent protein catabolic process via the C-end degron rule pathway,GO:0140627,4.998058252427184,0.005358256183779255,symptomatic
843,postsynaptic neurotransmitter receptor internalization,GO:0098884,4.998058252427184,0.03479024157060848,symptomatic
842,embryonic cleavage,GO:0040016,4.998058252427184,0.03480606250811216,symptomatic
840,cellular response to antibiotic,GO:0071236,4.998058252427184,0.005351283827001403,symptomatic
832,regulation of attachment of spindle microtubules to kinetochore,GO:0051988,4.998058252427184,4.4549937092961154e-05,symptomatic
873,renal system vasculature morphogenesis,GO:0061438,4.998058252427184,0.034695617160171645,symptomatic
829,positive regulation of attachment of mitotic spindle microtubules to kinetochore,GO:1902425,4.998058252427184,0.03488538352567851,symptomatic
821,glomerular mesangium development,GO:0072109,4.998058252427184,0.034901291133305354,symptomatic
807,positive regulation of cardiac muscle cell differentiation,GO:2000727,4.998058252427184,0.03491721325517274,symptomatic
274,regulation of deoxyribonuclease activity,GO:0032070,4.998058252427184,0.013499747124109307,symptomatic
802,I-kappaB phosphorylation,GO:0007252,4.998058252427184,0.03493314991115411,symptomatic
801,germinal center formation,GO:0002467,4.998058252427184,0.013521757581376876,symptomatic
797,clathrin coat disassembly,GO:0072318,4.998058252427184,0.0349491011211592,symptomatic
794,negative regulation of cell adhesion mediated by integrin,GO:0033629,4.998058252427184,0.005361749179987716,symptomatic
792,regulation of pro-B cell differentiation,GO:2000973,4.998058252427184,0.034965066905134144,symptomatic
308,regulation of cardiac epithelial to mesenchymal transition,GO:0062042,4.998058252427184,0.013470511071864349,symptomatic
790,regulation of germinal center formation,GO:0002634,4.998058252427184,0.034981047283061534,symptomatic
844,postsynaptic endocytosis,GO:0140239,4.998058252427184,0.03486949041245496,symptomatic
910,prostate glandular acinus development,GO:0060525,4.998058252427184,0.01344140137748971,symptomatic
764,regulation of vascular associated smooth muscle cell apoptotic process,GO:1905459,4.998058252427184,0.005347804448700363,symptomatic
263,synaptic vesicle endosomal processing,GO:0099532,4.998058252427184,0.03482189784137336,symptomatic
170,regulation of cell proliferation involved in heart morphogenesis,GO:2000136,4.998058252427184,0.0003082828141431143,symptomatic
863,"positive regulation of nuclear-transcribed mRNA catabolic process, deadenylation-dependent decay",GO:1900153,4.998058252427184,0.0008066013594230039,symptomatic
166,tongue morphogenesis,GO:0043587,4.998058252427184,0.013492426220028986,symptomatic
848,cellular response to leucine starvation,GO:1990253,4.998058252427184,0.013514412791816106,symptomatic
861,regulation of guanyl-nucleotide exchange factor activity,GO:1905097,4.998058252427184,0.034742864936604015,symptomatic
871,macrophage derived foam cell differentiation,GO:0010742,4.998058252427184,0.034727101386269804,symptomatic
869,regulation of dopaminergic neuron differentiation,GO:1904338,4.998058252427184,0.013463221834271349,symptomatic
370,negative regulation of fatty acid transport,GO:2000192,4.998058252427184,0.03483774759004945,symptomatic
872,kidney vasculature morphogenesis,GO:0061439,4.998058252427184,0.03471135213394043,symptomatic
859,negative regulation of gene expression via CpG island methylation,GO:0044027,4.998058252427184,0.03475864280442263,symptomatic
856,mitochondrial fragmentation involved in apoptotic process,GO:0043653,4.998058252427184,0.013507075977053992,symptomatic
855,regulation of cyclic-nucleotide phosphodiesterase activity,GO:0051342,4.998058252427184,0.034774435009240635,symptomatic
760,positive regulation of smooth muscle cell apoptotic process,GO:0034393,4.998058252427184,0.0008059011846318382,symptomatic
517,regulation of cytoplasmic translation,GO:2000765,4.846601941747573,5.40418343712644e-07,symptomatic
926,response to muscle stretch,GO:0035994,4.798135922330098,2.797395171566008e-05,symptomatic
928,positive regulation of protein import into nucleus,GO:0042307,4.760055478502081,1.652487353608492e-08,symptomatic
944,positive regulation of protein export from nucleus,GO:0046827,4.735002554931016,0.0005013417805638075,symptomatic
943,protein localization to cell-cell junction,GO:0150105,4.735002554931016,0.0005018025726415315,symptomatic
1222,response to hepatocyte growth factor,GO:0035728,4.70405482581382,0.0013243280342431932,symptomatic
685,positive regulation of cyclin-dependent protein kinase activity,GO:1904031,4.70405482581382,0.0013221390622857663,symptomatic
17,regulation of miRNA processing,GO:1903798,4.70405482581382,0.001323232642982446,symptomatic
502,leukocyte apoptotic process,GO:0071887,4.679033257591406,3.837113813154472e-09,symptomatic
569,columnar/cuboidal epithelial cell maturation,GO:0002069,4.664854368932039,0.0033571434123391927,symptomatic
