,pathway,pthwy_id,fold_enrichment,q-value,cohort
659,cellular response to environmental stimulus,GO:0104004,2.7629017668696862,1.309941240745715e-17,symptomatic
12,tube development,GO:0035295,2.758011049723757,0.03144067559620494,asymptomatic
1816,negative regulation of extrinsic apoptotic signaling pathway via death domain receptors,GO:1902042,2.7575493806494813,0.04186029465642965,symptomatic
1817,phosphatidylinositol dephosphorylation,GO:0046856,2.7575493806494813,0.04184182959482558,symptomatic
1819,regulation of androgen receptor signaling pathway,GO:0060765,2.7575493806494813,0.04182338081634462,symptomatic
1195,negative regulation of small GTPase mediated signal transduction,GO:0051058,2.7575493806494813,0.0015734860990355183,symptomatic
1359,cardiac ventricle development,GO:0003231,2.75483525724333,4.584385160151842e-07,symptomatic
515,regulation of amide metabolic process,GO:0034248,2.752880843323325,4.9135392734607314e-24,symptomatic
1822,fibroblast proliferation,GO:0048144,2.748932038834951,0.012280871444916984,symptomatic
1989,establishment of protein localization to endoplasmic reticulum,GO:0072599,2.748932038834951,0.012274082682371425,symptomatic
544,steroid hormone mediated signaling pathway,GO:0043401,2.748932038834951,0.00013091735584366194,symptomatic
1821,cellular response to nutrient,GO:0031670,2.748932038834951,0.012287667721311516,symptomatic
798,protein depolymerization,GO:0051261,2.748932038834951,0.012294471524036494,symptomatic
1687,positive regulation of cysteine-type endopeptidase activity,GO:2001056,2.7470243830134145,3.1809864164132545e-07,symptomatic
230,regulation of epithelial cell differentiation,GO:0030856,2.737789870756292,1.648314346203176e-08,symptomatic
112,response to decreased oxygen levels,GO:0036293,2.735093766800544,2.4904595707503083e-16,symptomatic
2075,intracellular glucose homeostasis,GO:0001678,2.7347865909507236,7.330862004458224e-06,symptomatic
1823,canonical Wnt signaling pathway,GO:0060070,2.7347865909507236,7.341158158958868e-06,symptomatic
1364,regulation of mitochondrion organization,GO:0010821,2.7322718446601946,4.172418703491524e-08,symptomatic
882,mesenchymal cell differentiation,GO:0048762,2.73149695190788,3.2316256097853223e-09,symptomatic
975,transmembrane receptor protein serine/threonine kinase signaling pathway,GO:0007178,2.73117937291103,8.801581578133747e-10,symptomatic
1623,regulation of insulin receptor signaling pathway,GO:0046626,2.7262135922330097,0.0007805625541331379,symptomatic
1834,positive regulation of ATP metabolic process,GO:1903580,2.7262135922330097,0.0295163110902563,symptomatic
1835,clathrin-dependent endocytosis,GO:0072583,2.7262135922330097,0.029502421061507942,symptomatic
1831,BMP signaling pathway,GO:0030509,2.7262135922330097,0.00022250670506751316,symptomatic
1829,hair follicle morphogenesis,GO:0031069,2.7262135922330097,0.02953021420428845,symptomatic
650,cellular response to peptide,GO:1901653,2.7262135922330097,3.082568662347548e-16,symptomatic
1828,regulation of fibroblast growth factor receptor signaling pathway,GO:0040036,2.7262135922330097,0.029558059762236858,symptomatic
1827,microtubule organizing center localization,GO:0061842,2.7262135922330097,0.029544130422103854,symptomatic
1826,centrosome localization,GO:0051642,2.7262135922330097,0.029572002243256783,symptomatic
1836,regulation of erythrocyte differentiation,GO:0045646,2.7262135922330093,0.008751589558800605,symptomatic
503,T cell homeostasis,GO:0043029,2.7262135922330093,0.008741281443890357,symptomatic
1804,muscle cell proliferation,GO:0033002,2.7262135922330093,0.008746432464187288,symptomatic
1078,negative regulation of mitotic cell cycle,GO:0045930,2.717838128047962,2.1160986509241344e-11,symptomatic
1861,regulation of TORC1 signaling,GO:1903432,2.716336006753904,4.541184948126e-05,symptomatic
655,cellular response to ionizing radiation,GO:0071479,2.7132316227461857,0.0005478553378296078,symptomatic
969,regulation of mitotic sister chromatid separation,GO:0010965,2.710811255553727,0.001905143761659179,symptomatic
1839,regulation of SMAD protein signal transduction,GO:0060390,2.710811255553727,0.0019081392707183916,symptomatic
1948,nucleoside diphosphate catabolic process,GO:0009134,2.710811255553727,0.0019066403396337738,symptomatic
453,positive regulation of binding,GO:0051099,2.710811255553727,2.5111866918775912e-06,symptomatic
1613,positive regulation of cell cycle G1/S phase transition,GO:1902808,2.710811255553727,0.0019036495312578778,symptomatic
1762,regulation of cellular response to transforming growth factor beta stimulus,GO:1903844,2.7072815533980585,1.3115655464291636e-07,symptomatic
1837,positive regulation of stem cell proliferation,GO:2000648,2.707281553398058,0.0062815910269421234,symptomatic
909,T cell selection,GO:0045058,2.707281553398058,0.006269701580203431,symptomatic
1518,regulation of muscle tissue development,GO:1901861,2.707281553398058,0.006277622870892254,symptomatic
527,modulation by host of viral process,GO:0044788,2.707281553398058,0.006273659725140429,symptomatic
1242,positive regulation of carbohydrate metabolic process,GO:0045913,2.7016531094201,0.0003841454075616131,symptomatic
1841,positive regulation of neuroblast proliferation,GO:0002052,2.7016531094201,0.02093170675796135,symptomatic
1850,response to activity,GO:0014823,2.7016531094201,0.0003845088374646988,symptomatic
1845,homeostasis of number of cells within a tissue,GO:0048873,2.7016531094201,0.020921172431460112,symptomatic
1838,positive regulation of SMAD protein signal transduction,GO:0060391,2.7016531094201,0.020942251698393574,symptomatic
1830,epidermis morphogenesis,GO:0048730,2.7016531094201,0.020910648702872858,symptomatic
1846,T cell proliferation,GO:0042098,2.7016531094201,0.00038487295568199494,symptomatic
1851,cardiac conduction system development,GO:0003161,2.7016531094201,0.020900135556214804,symptomatic
767,artery development,GO:0060840,2.69895145631068,2.2625083857172675e-05,symptomatic
430,mRNA stabilization,GO:0048255,2.697364771151179,0.0013451695862618505,symptomatic
111,response to hypoxia,GO:0001666,2.6951986480665364,5.614199170568476e-15,symptomatic
1761,regulation of transforming growth factor beta receptor signaling pathway,GO:0017015,2.6939888452799012,2.317897783453433e-07,symptomatic
1448,mitochondrion localization,GO:0051646,2.69126213592233,0.004498733807948992,symptomatic
1949,purine nucleoside diphosphate catabolic process,GO:0009137,2.69126213592233,0.004489639332595995,symptomatic
1138,membrane invagination,GO:0010324,2.69126213592233,0.004483596749375812,symptomatic
1860,positive regulation of TORC1 signaling,GO:1904263,2.69126213592233,0.0044866160064460986,symptomatic
1946,purine ribonucleoside diphosphate catabolic process,GO:0009181,2.69126213592233,0.00449266673605695,symptomatic
1852,positive regulation of stress fiber assembly,GO:0051496,2.69126213592233,0.004495698225082629,symptomatic
1775,response to UV,GO:0009411,2.69126213592233,4.3425682016446825e-08,symptomatic
1914,negative regulation of TOR signaling,GO:0032007,2.6855238371250545,0.0009364297202059181,symptomatic
113,response to oxygen levels,GO:0070482,2.6855238371250545,5.9980592144505e-17,symptomatic
593,regulation of transforming growth factor beta production,GO:0071634,2.681884915936538,0.014694695131758053,symptomatic
1198,negative regulation of protein kinase activity,GO:0006469,2.681884915936538,2.102822847493321e-08,symptomatic
793,regulation of hematopoietic progenitor cell differentiation,GO:1901532,2.681884915936538,0.014679087383344077,symptomatic
1241,positive regulation of glucose metabolic process,GO:0010907,2.681884915936538,0.014663512754820635,symptomatic
1108,regulation of T cell apoptotic process,GO:0070232,2.681884915936538,0.014671295935688373,symptomatic
1865,response to angiotensin,GO:1990776,2.681884915936538,0.014686887110965408,symptomatic
1864,regulation of activated T cell proliferation,GO:0046006,2.681884915936538,0.014702511458955797,symptomatic
1682,regulation of autophagy of mitochondrion,GO:1903146,2.681884915936538,0.014710336105820595,symptomatic
505,leukocyte homeostasis,GO:0001776,2.6793714342908617,3.862009159311683e-05,symptomatic
1870,somatic stem cell population maintenance,GO:0035019,2.6775312066574206,0.0032176644202352614,symptomatic
636,positive regulation of peptidase activity,GO:0010952,2.6775312066574206,1.4745416913674073e-08,symptomatic
1866,endoderm formation,GO:0001706,2.6775312066574206,0.0032199809532951857,symptomatic
930,positive regulation of intracellular transport,GO:0032388,2.675017092848352,2.828205103831521e-07,symptomatic
1719,negative regulation of myeloid cell differentiation,GO:0045638,2.673379995484308,0.0001357265849197906,symptomatic
1773,cellular response to light stimulus,GO:0071482,2.671375962504185,5.293767920474052e-06,symptomatic
424,regeneration,GO:0031099,2.669770246638124,3.6888897484425545e-08,symptomatic
1975,positive regulation of response to wounding,GO:1903036,2.6656310679611654,0.00046624330271718235,symptomatic
431,negative regulation of mRNA catabolic process,GO:1902373,2.6656310679611654,0.0004658111958564621,symptomatic
1872,embryonic cranial skeleton morphogenesis,GO:0048701,2.665631067961165,0.010484972529935589,symptomatic
1137,plasma membrane invagination,GO:0099024,2.665631067961165,0.01047900838173881,symptomatic
1871,semaphorin-plexin signaling pathway,GO:0071526,2.665631067961165,0.010490943471011862,symptomatic
1576,response to dexamethasone,GO:0071548,2.665631067961165,0.01049692121657939,symptomatic
1596,cardiac muscle tissue morphogenesis,GO:0055008,2.665631067961165,0.002261643436285226,symptomatic
648,response to peptide,GO:1901652,2.6613037447988908,7.383446299975632e-23,symptomatic
1504,cellular response to chemical stress,GO:0062197,2.6608367674792204,9.844468615005818e-14,symptomatic
1878,positive regulation of phosphatidylinositol 3-kinase/protein kinase B signal transduction,GO:0051897,2.657926931926595,1.2432740057655949e-08,symptomatic
1723,regulation of myeloid leukocyte differentiation,GO:0002761,2.6552184466019417,1.8140418155708418e-06,symptomatic
1880,dendrite morphogenesis,GO:0048813,2.6552184466019417,0.0016279968803252936,symptomatic
1997,regulation of transcription by RNA polymerase I,GO:0006356,2.652030909451159,0.007613240262162499,symptomatic
1883,protein targeting to vacuole,GO:0006623,2.652030909451159,0.007617954342820184,symptomatic
1940,ADP catabolic process,GO:0046032,2.652030909451159,0.007622674264965674,symptomatic
1376,import into nucleus,GO:0051170,2.6485436893203884,6.4543087609566185e-06,symptomatic
1532,regulation of myeloid cell differentiation,GO:0045637,2.6460308395202743,5.622133206010925e-10,symptomatic
1858,regulation of actomyosin structure organization,GO:0110020,2.6460308395202743,3.286278660191714e-05,symptomatic
1890,organ growth,GO:0035265,2.6460308395202743,3.282211483632071e-05,symptomatic
1889,cardiac muscle tissue growth,GO:0055017,2.646030839520274,0.03505630959643564,symptomatic
1887,virion assembly,GO:0019068,2.646030839520274,0.03510374709250659,symptomatic
1888,regulation of endoplasmic reticulum stress-induced intrinsic apoptotic signaling pathway,GO:1902235,2.646030839520274,0.035087920335476606,symptomatic
1882,protein targeting to lysosome,GO:0006622,2.646030839520274,0.035119588133613315,symptomatic
1256,response to prostaglandin,GO:0034694,2.646030839520274,0.035040525575905944,symptomatic
1744,response to interleukin-4,GO:0070670,2.646030839520274,0.03507210784321185,symptomatic
656,cellular response to radiation,GO:0071478,2.642651489789086,1.5158651651966135e-08,symptomatic
528,modulation by host of symbiont process,GO:0051851,2.642651489789086,0.0001621386132584748,symptomatic
883,mesenchyme development,GO:0060485,2.641250295998106,6.256432881105137e-12,symptomatic
1891,mRNA transcription,GO:0009299,2.640483605055871,0.005337814515611241,symptomatic
1706,regulation of peptidyl-serine phosphorylation,GO:0033135,2.6389747572815536,3.1416869857463225e-06,symptomatic
1863,positive regulation of TOR signaling,GO:0032008,2.637864077669903,0.0007977233736521787,symptomatic
1748,positive regulation of cell growth,GO:0030307,2.6370123295014594,5.423478653038486e-08,symptomatic
647,response to peptide hormone,GO:0043434,2.630556974961676,3.700237296389777e-18,symptomatic
1899,endothelial cell proliferation,GO:0001935,2.6305569749616757,0.02494694059556951,symptomatic
1081,mitotic cell cycle process,GO:1903047,2.626430611079383,2.4910641723343087e-24,symptomatic
1046,regulation of protein ubiquitination,GO:0031396,2.6252427184466014,1.729668938510129e-09,symptomatic
1901,cellular response to virus,GO:0098586,2.6239805825242715,0.00039417007190268905,symptomatic
438,negative regulation of cellular catabolic process,GO:0031330,2.6234151913192463,1.5446378835649615e-10,symptomatic
1905,JNK cascade,GO:0007254,2.6219321979945884,0.0027188500798740424,symptomatic
1907,maintenance of protein localization in organelle,GO:0072595,2.6180305131761448,0.017731043589175356,symptomatic
1910,fat cell differentiation,GO:0045444,2.6180305131761443,3.7620698045342403e-06,symptomatic
241,regulation of morphogenesis of an epithelium,GO:1905330,2.614368932038835,0.0019374225037794082,symptomatic
927,response to mechanical stimulus,GO:0009612,2.611598005772763,1.87059851435547e-10,symptomatic
1913,negative regulation of TORC1 signaling,GO:1904262,2.6076825664837484,0.012451887810326792,symptomatic
1318,regulation of ERBB signaling pathway,GO:1901184,2.6076825664837484,0.001372363040198682,symptomatic
1911,blastocyst formation,GO:0001825,2.6076825664837484,0.012465571203524954,symptomatic
1669,regulation of embryonic development,GO:0045995,2.6076825664837484,0.00013775995607650287,symptomatic
1853,regulation of stress fiber assembly,GO:0051492,2.6076825664837484,0.00013790760876254414,symptomatic
1546,regulation of myelination,GO:0031641,2.6076825664837484,0.012458725749816263,symptomatic
175,regulation of oxidoreductase activity,GO:0051341,2.6076825664837484,0.0013734907008726331,symptomatic
1724,regulation of osteoclast differentiation,GO:0045670,2.6017289533182604,0.0009542773653775701,symptomatic
1503,cellular response to oxidative stress,GO:0034599,2.599886803953154,2.273759003440908e-10,symptomatic
1491,Golgi to plasma membrane transport,GO:0006893,2.5989902912621363,0.00889620747365903,symptomatic
1915,morphogenesis of a polarized epithelium,GO:0001738,2.5989902912621363,0.008885753645840395,symptomatic
893,T cell differentiation involved in immune response,GO:0002292,2.5989902912621363,0.008890977486902029,symptomatic
136,regulation of endopeptidase activity,GO:0052548,2.5982685499982474,8.122191358031677e-13,symptomatic
1843,regulation of neural precursor cell proliferation,GO:2000177,2.595145631067961,4.7568773197811145e-05,symptomatic
96,positive regulation of apoptotic process,GO:0043065,2.595145631067961,5.412992997607527e-24,symptomatic
1916,viral gene expression,GO:0019080,2.591585760517799,0.006361391285537152,symptomatic
961,regulation of mitotic cell cycle,GO:0007346,2.5893554801731193,7.719311106828429e-23,symptomatic
1917,nucleus organization,GO:0006997,2.586407766990291,1.0798811576966236e-06,symptomatic
1621,response to estradiol,GO:0032355,2.585202544358889,1.630023081944404e-05,symptomatic
1859,positive regulation of actin filament bundle assembly,GO:0032233,2.579642968994676,0.0032448352687857395,symptomatic
1247,regulation of cell-substrate adhesion,GO:0010810,2.579642968994676,6.981567343254108e-10,symptomatic
618,regulation of microtubule polymerization,GO:0031113,2.579642968994676,0.0032425125520579045,symptomatic
2016,regulation of chemokine production,GO:0032642,2.5763186868181362,0.0001156647899758147,symptomatic
1918,positive regulation of non-canonical NF-kappaB signal transduction,GO:1901224,2.5747572815533983,0.002285453890454478,symptomatic
960,regulation of mitotic cell cycle phase transition,GO:1901990,2.5738503575373524,5.255881884773525e-15,symptomatic
1204,negative regulation of kinase activity,GO:0033673,2.5704299583911236,5.553892915100756e-08,symptomatic
247,regulation of kidney development,GO:0090183,2.570429958391123,0.042076222750497876,symptomatic
1923,cellular response to retinoic acid,GO:0071300,2.570429958391123,0.0016428881939815798,symptomatic
1920,regulation of collagen biosynthetic process,GO:0032965,2.570429958391123,0.0421132779884992,symptomatic
1922,integrated stress response signaling,GO:0140467,2.570429958391123,0.04209474221473665,symptomatic
834,regulation of sister chromatid segregation,GO:0033045,2.570429958391123,5.6905988946689654e-05,symptomatic
908,positive T cell selection,GO:0043368,2.570429958391123,0.04205771957426634,symptomatic
1091,DNA damage checkpoint signaling,GO:0000077,2.5653750322192628,2.7952528640646113e-05,symptomatic
1927,negative regulation of ossification,GO:0030279,2.5631067961165046,0.02965869495852638,symptomatic
1925,negative regulation of actin filament depolymerization,GO:0030835,2.5631067961165046,0.029672645426521923,symptomatic
1336,regulation of sprouting angiogenesis,GO:1903670,2.5631067961165046,0.029644757601872938,symptomatic
1722,negative regulation of hemopoiesis,GO:1903707,2.5631067961165046,1.9612258262858637e-05,symptomatic
1929,oligodendrocyte differentiation,GO:0048709,2.559981056121241,0.000566699231875484,symptomatic
1089,negative regulation of mitotic cell cycle phase transition,GO:1901991,2.5585298196948685,1.4167757624179644e-07,symptomatic
1932,positive regulation of substrate adhesion-dependent cell spreading,GO:1900026,2.557146082637164,0.020965960050554365,symptomatic
1931,response to testosterone,GO:0033574,2.557146082637164,0.02098703136718809,symptomatic
1935,positive regulation of receptor signaling pathway via JAK-STAT,GO:0046427,2.557146082637164,0.020955440251231458,symptomatic
693,musculoskeletal movement,GO:0050881,2.557146082637164,0.020976490417229682,symptomatic
576,digestive tract development,GO:0048565,2.555398204248485,4.5484332905020184e-06,symptomatic
1938,positive regulation of peptidyl-serine phosphorylation,GO:0033138,2.552199958686222,0.000194716008475888,symptomatic
1955,axon extension,GO:0048675,2.552199958686222,0.014697569319218767,symptomatic
1939,glycolytic process,GO:0006096,2.552199958686222,0.014705362304011566,symptomatic
1936,positive regulation of receptor signaling pathway via STAT,GO:1904894,2.552199958686222,0.014689784589706469,symptomatic
97,positive regulation of programmed cell death,GO:0043068,2.549841178687436,9.404713571079941e-24,symptomatic
1958,mitotic spindle assembly,GO:0090307,2.5480296973158194,0.010497433846700766,symptomatic
1967,positive chemotaxis,GO:0050918,2.5480296973158194,0.010491469395651503,symptomatic
567,regulation of lipid storage,GO:0010883,2.5480296973158194,0.010479560803828971,symptomatic
1485,establishment of protein localization to plasma membrane,GO:0061951,2.5480296973158194,0.010485511718538697,symptomatic
1968,"regulation of alternative mRNA splicing, via spliceosome",GO:0000381,2.5444660194174755,0.007619431230898733,symptomatic
1947,ribonucleoside diphosphate catabolic process,GO:0009191,2.5444660194174755,0.007614722064501391,symptomatic
1360,cardiac chamber development,GO:0003205,2.5433905899925318,1.7003447547415038e-07,symptomatic
1972,"positive regulation of DNA-templated transcription, elongation",GO:0032786,2.541385552081619,0.005337877668157611,symptomatic
1973,aorta development,GO:0035904,2.541385552081619,0.005334420493502069,symptomatic
973,regulation of mitotic nuclear division,GO:0007088,2.541385552081619,2.3592929921329055e-05,symptomatic
1974,positive regulation of wound healing,GO:0090303,2.5386962552011094,0.0038485717024674478,symptomatic
1077,mitotic cell cycle checkpoint signaling,GO:0007093,2.5374757281553397,7.882428438174032e-06,symptomatic
1977,positive regulation of fat cell differentiation,GO:0045600,2.5363280683958846,0.0027191743322615017,symptomatic
1284,regulation of generation of precursor metabolites and energy,GO:0043467,2.5352469396369774,3.7855759710678507e-06,symptomatic
2019,embryonic heart tube morphogenesis,GO:0003143,2.5342267195405443,0.0019366960570652118,symptomatic
1597,muscle tissue morphogenesis,GO:0060415,2.5342267195405443,0.0019382079197170974,symptomatic
1072,signal transduction in response to DNA damage,GO:0042770,2.5332624019151484,1.8629742865271705e-06,symptomatic
1334,regulation of vasculature development,GO:1901342,2.5327997900813437,9.811899326657416e-13,symptomatic
1045,regulation of protein modification by small protein conjugation or removal,GO:1903320,2.5301373725979937,2.2752131673705628e-10,symptomatic
437,negative regulation of RNA catabolic process,GO:1902369,2.5277535989286912,0.0004708695471545646,symptomatic
1900,epithelial cell proliferation,GO:0050673,2.527108105159812,9.670505556508e-08,symptomatic
1239,regulation of G2/M transition of mitotic cell cycle,GO:0010389,2.523291544914695,0.00011530462099494087,symptomatic
1425,positive regulation of protein catabolic process,GO:0045732,2.5228294036061025,5.176667656007111e-09,symptomatic
1314,regulation of signaling receptor activity,GO:0010469,2.522384538608112,8.001749297216561e-05,symptomatic
1253,cellular response to ketone,GO:1901655,2.522384538608112,8.010719868177567e-05,symptomatic
666,regulation of protein kinase activity,GO:0045859,2.5205724807499164,1.4245774051474486e-19,symptomatic
1683,regulation of autophagy,GO:0010506,2.5200293709716894,6.108491365323542e-15,symptomatic
836,regulation of chromosome segregation,GO:0051983,2.518105684428963,9.431240478845978e-06,symptomatic
1862,regulation of TOR signaling,GO:0032006,2.516504854368932,3.1756644214776723e-06,symptomatic
1978,peptidyl-serine phosphorylation,GO:0018105,2.5143605932455775,5.138043529148571e-07,symptomatic
839,positive regulation of cell cycle process,GO:0090068,2.5088292404340375,1.7538340669104802e-10,symptomatic
582,positive regulation of cell migration,GO:0030335,2.5036313897977793,1.2946791844079948e-22,symptomatic
335,negative regulation of lipid biosynthetic process,GO:0051055,2.4990291262135926,0.008791431754698516,symptomatic
1720,negative regulation of leukocyte differentiation,GO:1902106,2.4990291262135926,6.68934801776116e-05,symptomatic
214,hair follicle development,GO:0001942,2.4990291262135926,0.0007962440396248143,symptomatic
324,positive regulation of organelle assembly,GO:1902117,2.4990291262135926,0.0007955510509045141,symptomatic
2103,regulation of stem cell population maintenance,GO:2000036,2.499029126213592,0.0022642540821456053,symptomatic
1987,translational initiation,GO:0006413,2.499029126213592,0.002265961664409667,symptomatic
2066,myeloid cell homeostasis,GO:0002262,2.499029126213592,5.405826334958812e-06,symptomatic
1992,skeletal muscle cell differentiation,GO:0035914,2.499029126213592,0.006292487776187381,symptomatic
1996,positive regulation of transcription by RNA polymerase I,GO:0045943,2.499029126213592,0.049969022402831874,symptomatic
1813,homotypic cell-cell adhesion,GO:0034109,2.499029126213592,0.004491827140403796,symptomatic
1842,positive regulation of neural precursor cell proliferation,GO:2000179,2.499029126213592,0.004488808439368578,symptomatic
2190,cardiocyte differentiation,GO:0035051,2.499029126213592,3.2983199767305256e-05,symptomatic
1959,mitotic spindle organization,GO:0007052,2.499029126213592,0.00027570789683453294,symptomatic
1510,epithelial cell migration,GO:0010631,2.499029126213592,0.0001370251382875529,symptomatic
1854,regulation of actin filament bundle assembly,GO:0032231,2.499029126213592,0.0001371723188872173,symptomatic
443,RNA stabilization,GO:0043489,2.499029126213592,0.00226254907154158,symptomatic
675,positive regulation of cell cycle,GO:0045787,2.499029126213592,2.6852261800386415e-13,symptomatic
1991,DNA synthesis involved in DNA repair,GO:0000731,2.499029126213592,0.034710763367697565,symptomatic
1921,regulation of collagen metabolic process,GO:0010712,2.499029126213592,0.034679379314019716,symptomatic
454,regulation of binding,GO:0051098,2.499029126213592,8.798629711082609e-10,symptomatic
1988,protein targeting to ER,GO:0045047,2.499029126213592,0.04999047754340844,symptomatic
1995,regulation of JUN kinase activity,GO:0043506,2.499029126213592,0.03469506424360543,symptomatic
1082,mitotic cell cycle,GO:0000278,2.4906148867313913,2.1902560534879067e-24,symptomatic
1213,rhythmic process,GO:0048511,2.4897390551124263,6.556023897275149e-11,symptomatic
25,regulation of multicellular organismal development,GO:2000026,2.488888888888889,0.008491719817591047,asymptomatic
924,respiratory tube development,GO:0030323,2.4860807887720715,5.43273641881846e-08,symptomatic
922,lung development,GO:0030324,2.48580674988442,7.894734446088506e-08,symptomatic
1606,regulation of reactive oxygen species metabolic process,GO:2000377,2.481794442584533,4.465140769964562e-06,symptomatic
577,digestive system development,GO:0055123,2.481794442584533,4.458706849546745e-06,symptomatic
1333,regulation of angiogenesis,GO:0045765,2.481794442584533,1.0882361403442585e-11,symptomatic
676,positive regulation of protein serine/threonine kinase activity,GO:0071902,2.479656807405735,1.9255869480549562e-05,symptomatic
455,regulation of protein binding,GO:0043393,2.479656807405735,1.9230698409333158e-05,symptomatic
1044,regulation of post-translational protein modification,GO:1901873,2.478711816244376,7.252688196262815e-10,symptomatic
1277,negative regulation of small molecule metabolic process,GO:0062014,2.4761022534960366,0.0001134189974849508,symptomatic
321,regulation of carbohydrate biosynthetic process,GO:0043255,2.473265939345411,0.00032811734443672367,symptomatic
1998,multicellular organism growth,GO:0035264,2.4721578452865645,0.00046425752556476547,symptomatic
1999,ureteric bud development,GO:0001657,2.470950147267372,0.0006645753004763385,symptomatic
2020,embryonic heart tube development,GO:0035050,2.4696287835522557,0.0009369540531029319,symptomatic
