pathway,pthwy_id,fold_enrichment,q-value,cohort
cochlear nucleus development,GO:0021747,9.996116504854369,0.00894936918670939,symptomatic
positive regulation of macrophage apoptotic process,GO:2000111,9.996116504854369,0.008923170799160475,symptomatic
positive regulation of viral translation,GO:1904973,9.996116504854369,0.008912734342085433,symptomatic
regulation of viral translation,GO:1904971,9.996116504854369,0.008907525262984273,symptomatic
sphingolipid translocation,GO:0099039,9.996116504854369,0.008902322269255894,symptomatic
regulation of mast cell apoptotic process,GO:0033025,9.996116504854369,0.00892839819857416,symptomatic
negative regulation of metalloendopeptidase activity,GO:1904684,9.996116504854369,0.008897125350242901,symptomatic
positive regulation of heparan sulfate proteoglycan biosynthetic process,GO:0010909,9.996116504854369,0.00889193449531277,symptomatic
viral penetration into host nucleus,GO:0075732,9.996116504854369,0.0012657282783194138,symptomatic
positive regulation of B cell apoptotic process,GO:0002904,9.996116504854369,0.008886749693857778,symptomatic
fungiform papilla formation,GO:0061198,9.996116504854369,0.008881570935294925,symptomatic
osteoblast fate commitment,GO:0002051,9.996116504854369,0.008933631726240381,symptomatic
regulation of cell proliferation involved in heart valve morphogenesis,GO:0003250,9.996116504854369,0.008876398209065864,symptomatic
positive regulation of calcidiol 1-monooxygenase activity,GO:0060559,9.996116504854369,0.00887123150463684,symptomatic
apoptotic process involved in embryonic digit morphogenesis,GO:1902263,9.996116504854369,0.008938871392941989,symptomatic
intrinsic apoptotic signaling pathway in response to hypoxia,GO:1990144,9.996116504854369,0.008917949517241714,symptomatic
negative regulation of primary miRNA processing,GO:2000635,9.996116504854369,0.0012667812968537894,symptomatic
central nervous system morphogenesis,GO:0021551,9.996116504854369,0.008944117209487143,symptomatic
regulation of primary miRNA processing,GO:2000634,8.33009708737864,0.0007402360967473025,symptomatic
cytoplasmic sequestering of NF-kappaB,GO:0007253,8.33009708737864,0.0007408917531660334,symptomatic
maintenance of DNA repeat elements,GO:0043570,8.33009708737864,0.0007395815997563676,symptomatic
regulation of protein localization to endoplasmic reticulum,GO:1905550,7.996893203883494,0.004676312075540983,symptomatic
regulation of termination of DNA-templated transcription,GO:0031554,7.996893203883494,0.0046700769927735955,symptomatic
cranial ganglion development,GO:0061550,7.996893203883494,0.004663858514753923,symptomatic
glial cell apoptotic process,GO:0034349,7.996893203883494,0.004654561786817537,symptomatic
hair follicle placode formation,GO:0060789,7.996893203883494,0.0046607554818099755,symptomatic
fungiform papilla morphogenesis,GO:0061197,7.996893203883494,0.004657656575239623,symptomatic
positive regulation of sulfur metabolic process,GO:0051176,7.996893203883494,0.004673192454409869,symptomatic
regulation of metalloendopeptidase activity,GO:1904683,7.996893203883494,0.004666965682318717,symptomatic
positive regulation of endodeoxyribonuclease activity,GO:0032079,7.497087378640777,0.027152185623523045,symptomatic
regulation of epithelial to mesenchymal transition involved in endocardial cushion formation,GO:1905005,7.497087378640777,0.02706098346451889,symptomatic
positive regulation of epithelial to mesenchymal transition involved in endocardial cushion formation,GO:1905007,7.497087378640777,0.027073974815197965,symptomatic
hepatocyte growth factor receptor signaling pathway,GO:0048012,7.497087378640777,0.000339522379999053,symptomatic
establishment or maintenance of microtubule cytoskeleton polarity,GO:0030951,7.497087378640777,0.027099994973597965,symptomatic
regulation of leukocyte adhesion to arterial endothelial cell,GO:1904997,7.497087378640777,0.02711302381733527,symptomatic
protein localization to lipid droplet,GO:1990044,7.497087378640777,0.027126065194832787,symptomatic
anterograde neuronal dense core vesicle transport,GO:1990048,7.497087378640777,0.02713911912418545,symptomatic
endoplasmic reticulum tubular network membrane organization,GO:1990809,7.497087378640777,0.027230849608912294,symptomatic
synaptic vesicle recycling via endosome,GO:0036466,7.497087378640777,0.02716526471101029,symptomatic
negative regulation of lysosome organization,GO:1905672,7.497087378640777,0.02717835640484692,symptomatic
positive regulation of fibroblast growth factor production,GO:0090271,7.497087378640777,0.027191460723267773,symptomatic
regulation of Schwann cell differentiation,GO:0014038,7.497087378640777,0.027217707306977493,symptomatic
neuropilin signaling pathway,GO:0038189,7.497087378640777,0.027244004608723362,symptomatic
regulation of ureteric bud formation,GO:0072106,7.497087378640777,0.02725717232482231,symptomatic
positive regulation of ureteric bud formation,GO:0072107,7.497087378640777,0.027270352775656367,symptomatic
negative regulation of epithelial cell differentiation involved in kidney development,GO:2000697,7.497087378640777,0.02728354597970845,symptomatic
regulation of heparan sulfate proteoglycan biosynthetic process,GO:0010908,7.497087378640777,0.027022084111191835,symptomatic
regulation of termination of RNA polymerase II transcription,GO:1904594,7.497087378640777,0.02704800457556708,symptomatic
negative regulation of myofibroblast differentiation,GO:1904761,7.497087378640777,0.027086978645560693,symptomatic
negative regulation of hyaluronan biosynthetic process,GO:1900126,7.497087378640777,0.027035038130420595,symptomatic
vasculogenesis involved in coronary vascular morphogenesis,GO:0060979,7.497087378640777,0.026931752406904184,symptomatic
negative regulation of triglyceride biosynthetic process,GO:0010868,7.497087378640777,0.02699621327910836,symptomatic
negative regulation of bicellular tight junction assembly,GO:1903347,7.497087378640777,0.02685480454288446,symptomatic
cardiac muscle tissue regeneration,GO:0061026,7.497087378640777,0.026867598637473733,symptomatic
positive regulation of oxidative stress-induced neuron intrinsic apoptotic signaling pathway,GO:1903378,7.497087378640777,0.02688040492853068,symptomatic
formation of radial glial scaffolds,GO:0021943,7.497087378640777,0.02689322343350375,symptomatic
actin modification,GO:0030047,7.497087378640777,0.026906054169874696,symptomatic
retinal cell programmed cell death,GO:0046666,7.497087378640777,0.026918897155158647,symptomatic
positive regulation of stress granule assembly,GO:0062029,7.497087378640777,0.027009142500027474,symptomatic
negative regulation of long-chain fatty acid import into cell,GO:0140213,7.497087378640777,0.027204577684542867,symptomatic
trigeminal ganglion development,GO:0061551,7.497087378640777,0.026983296430649457,symptomatic
Langerhans cell differentiation,GO:0061520,7.497087378640777,0.02695749978014214,symptomatic
negative regulation of long-chain fatty acid import across plasma membrane,GO:0010748,7.497087378640777,0.026944619942693437,symptomatic
negative regulation of dendrite extension,GO:1903860,7.497087378640777,0.02697039193689974,symptomatic
CRD-mediated mRNA stabilization,GO:0070934,7.269902912621359,2.4227316126345384e-05,symptomatic
corticosteroid receptor signaling pathway,GO:0031958,7.140083217753121,0.0020588375067446723,symptomatic
regulation of vitamin D biosynthetic process,GO:0060556,7.140083217753121,0.0020478444765789877,symptomatic
random inactivation of X chromosome,GO:0060816,7.140083217753121,0.0020494077166374448,symptomatic
glutathione transmembrane transport,GO:0034775,7.140083217753121,0.002050973345145189,symptomatic
negative regulation of hepatocyte apoptotic process,GO:1903944,7.140083217753121,0.0020525413675803153,symptomatic
post-embryonic camera-type eye development,GO:0031077,7.140083217753121,0.0020541117894376836,symptomatic
positive regulation of receptor binding,GO:1900122,7.140083217753121,0.0020556846162289835,symptomatic
negative regulation of hydrogen peroxide-mediated programmed cell death,GO:1901299,7.140083217753121,0.002057259853482799,symptomatic
odontoblast differentiation,GO:0071895,7.140083217753121,0.0020604175815771703,symptomatic
regulation of hydrogen peroxide-mediated programmed cell death,GO:1901298,6.997281553398058,0.00014722958148482665,symptomatic
glucocorticoid receptor signaling pathway,GO:0042921,6.6640776699029125,0.010872632315073046,symptomatic
intestinal epithelial cell maturation,GO:0060574,6.6640776699029125,0.010836085651829103,symptomatic
negative regulation of sequestering of triglyceride,GO:0010891,6.6640776699029125,0.010854328220266527,symptomatic
"negative regulation of nuclear-transcribed mRNA catabolic process, deadenylation-dependent decay",GO:1900152,6.6640776699029125,6.023336319707194e-05,symptomatic
pyrimidine deoxyribonucleoside triphosphate metabolic process,GO:0009211,6.6640776699029125,0.010860422733585036,symptomatic
positive regulation of cell proliferation in bone marrow,GO:0071864,6.6640776699029125,0.010909426333059757,symptomatic
negative regulation of cytoplasmic translation,GO:2000766,6.6640776699029125,0.0008417478399862092,symptomatic
activation-induced cell death of T cells,GO:0006924,6.6640776699029125,0.010915582894195796,symptomatic
negative regulation of cardiac muscle adaptation,GO:0010616,6.6640776699029125,0.010848240543194027,symptomatic
positive regulation of cell proliferation involved in heart morphogenesis,GO:2000138,6.6640776699029125,0.010878747406363864,symptomatic
hair follicle maturation,GO:0048820,6.6640776699029125,0.010884869380143472,symptomatic
negative regulation of cardiac muscle hypertrophy in response to stress,GO:1903243,6.6640776699029125,0.010921746407970044,symptomatic
fungiform papilla development,GO:0061196,6.6640776699029125,0.010842159690871609,symptomatic
interleukin-11-mediated signaling pathway,GO:0038154,6.6640776699029125,0.010890998248037697,symptomatic
response to indole-3-methanol,GO:0071680,6.6640776699029125,0.01090327671280437,symptomatic
regulation of myofibroblast differentiation,GO:1904760,6.6640776699029125,0.01086652409467132,symptomatic
modulation by host of viral RNA genome replication,GO:0044830,6.6640776699029125,0.010897134021698564,symptomatic
positive regulation of fibroblast migration,GO:0010763,6.426074895977809,2.4275758459809546e-05,symptomatic
interleukin-6-mediated signaling pathway,GO:0070102,6.426074895977809,2.4307041653701053e-05,symptomatic
negative regulation of miRNA-mediated gene silencing,GO:0060965,6.426074895977809,2.4244555685439612e-05,symptomatic
somatic stem cell division,GO:0048103,6.361165048543689,0.0003331628580409659,symptomatic
negative regulation of miRNA processing,GO:1903799,6.361165048543689,0.00033284343056441657,symptomatic
regulation of epithelial cell differentiation,GO:0030856,6.359235668789809,0.030364317973533873,asymptomatic
regulation of transforming growth factor beta2 production,GO:0032909,6.247572815533981,0.004473295461356313,symptomatic
regulation of endodeoxyribonuclease activity,GO:0032071,6.247572815533981,0.004455086660292447,symptomatic
regulation of stress granule assembly,GO:0062028,6.247572815533981,0.004446037736811827,symptomatic
necroptotic signaling pathway,GO:0097527,6.247572815533981,0.004443029592199639,symptomatic
positive regulation of aspartic-type endopeptidase activity involved in amyloid precursor protein catabolic process,GO:1902961,6.247572815533981,0.00444002551539626,symptomatic
negative regulation of stress-activated MAPK cascade,GO:0032873,6.247572815533981,0.004470250331702565,symptomatic
positive regulation of cell migration by vascular endothelial growth factor signaling pathway,GO:0038089,6.247572815533981,0.004467209345082359,symptomatic
internal peptidyl-lysine acetylation,GO:0018393,6.247572815533981,0.004464172493046273,symptomatic
intracellular transport of virus,GO:0075733,6.247572815533981,0.004461139767167845,symptomatic
positive regulation of microtubule nucleation,GO:0090063,6.247572815533981,0.004458111159043494,symptomatic
regulation of hepatocyte apoptotic process,GO:1903943,6.247572815533981,0.004449049957500723,symptomatic
regulation of hyaluronan biosynthetic process,GO:1900125,6.247572815533981,0.004452066262556656,symptomatic
growth hormone receptor signaling pathway via JAK-STAT,GO:0060397,5.997669902912621,0.0017739201119937877,symptomatic
negative regulation of gene silencing by regulatory ncRNA,GO:0060967,5.997669902912621,5.058592194886931e-05,symptomatic
cellular response to X-ray,GO:0071481,5.997669902912621,0.0017725111206419262,symptomatic
foregut morphogenesis,GO:0007440,5.997669902912621,0.0017753313451775536,symptomatic
negative regulation of post-transcriptional gene silencing,GO:0060149,5.997669902912621,5.070536922619839e-05,symptomatic
negative regulation of post-transcriptional gene silencing by regulatory ncRNA,GO:1900369,5.997669902912621,5.064557515871467e-05,symptomatic
voluntary musculoskeletal movement,GO:0050882,5.712066574202497,0.021060651086552334,symptomatic
regulation of epithelial cell proliferation involved in lung morphogenesis,GO:2000794,5.712066574202497,0.021092723144044548,symptomatic
negative regulation of centriole replication,GO:0046600,5.712066574202497,0.020965017453969607,symptomatic
regulation of myosin-light-chain-phosphatase activity,GO:0035507,5.712066574202497,0.020996798683055967,symptomatic
regulation of mast cell proliferation,GO:0070666,5.712066574202497,0.021071330929902515,symptomatic
vascular endothelial growth factor production,GO:0010573,5.712066574202497,0.020954445080064426,symptomatic
positive regulation of pinocytosis,GO:0048549,5.712066574202497,0.021049982063712138,symptomatic
chaperone-mediated autophagy,GO:0061684,5.712066574202497,0.020986194239276647,symptomatic
dorsal root ganglion development,GO:1990791,5.712066574202497,0.021082021610232246,symptomatic
regulation of cell proliferation in bone marrow,GO:0071863,5.712066574202497,0.021103435547875957,symptomatic
positive regulation of nuclease activity,GO:0032075,5.712066574202497,0.0210393238449457,symptomatic
inflammatory cell apoptotic process,GO:0006925,5.712066574202497,0.021114158838296624,symptomatic
response to luteinizing hormone,GO:0034699,5.712066574202497,0.02097560050164955,symptomatic
positive regulation of cyclin-dependent protein serine/threonine kinase activity,GO:0045737,5.712066574202497,0.0002593574389322493,symptomatic
ribosomal large subunit export from nucleus,GO:0000055,5.712066574202497,0.02100741384922536,symptomatic
limb joint morphogenesis,GO:0036022,5.712066574202497,0.021018039754055518,symptomatic
post-embryonic eye morphogenesis,GO:0048050,5.712066574202497,0.02102867641385008,symptomatic
regulation of calcidiol 1-monooxygenase activity,GO:0060558,5.712066574202497,0.020943883363794234,symptomatic
intestinal epithelial cell development,GO:0060576,5.6228155339805825,9.901910211663434e-05,symptomatic
positive regulation of cardiac epithelial to mesenchymal transition,GO:0062043,5.553398058252427,0.00814652207034595,symptomatic
glutathione transport,GO:0034635,5.553398058252427,0.008136742331966183,symptomatic
positive regulation of aspartic-type peptidase activity,GO:1905247,5.553398058252427,0.008156325346002202,symptomatic
regulation of epithelial tube formation,GO:1905276,5.553398058252427,0.008161235836878784,symptomatic
positive regulation of vascular associated smooth muscle cell apoptotic process,GO:1905461,5.553398058252427,0.008171074578092621,symptomatic
cellular response to insulin-like growth factor stimulus,GO:1990314,5.553398058252427,0.008185877249429745,symptomatic
negative regulation of stress-activated protein kinase signaling cascade,GO:0070303,5.553398058252427,0.00817600284985263,symptomatic
tripeptide transmembrane transport,GO:0035443,5.553398058252427,0.008151420760706952,symptomatic
embryonic foregut morphogenesis,GO:0048617,5.553398058252427,0.008180937070039626,symptomatic
positive regulation of epithelial tube formation,GO:1905278,5.553398058252427,0.008166152244009434,symptomatic
negative regulation of muscle adaptation,GO:0014745,5.553398058252427,0.008117253128775844,symptomatic
negative regulation of synapse assembly,GO:0051964,5.553398058252427,0.00820073365097136,symptomatic
regulation of chronic inflammatory response,GO:0002676,5.553398058252427,0.00821066791341954,symptomatic
response to oxygen-glucose deprivation,GO:0090649,5.553398058252427,0.008195775529054207,symptomatic
mesenchymal-epithelial cell signaling,GO:0060638,5.553398058252427,0.008126986046196438,symptomatic
positive regulation of myeloid cell apoptotic process,GO:0033034,5.553398058252427,0.008190823398825172,symptomatic
regulation of aspartic-type endopeptidase activity involved in amyloid precursor protein catabolic process,GO:1902959,5.553398058252427,0.008122116671693026,symptomatic
regulation of attachment of mitotic spindle microtubules to kinetochore,GO:1902423,5.553398058252427,0.00820569777545742,symptomatic
coronary artery morphogenesis,GO:0060982,5.553398058252427,0.008141629264297694,symptomatic
regulation of branching involved in salivary gland morphogenesis,GO:0060693,5.553398058252427,0.00813186126278084,symptomatic
positive regulation of leukocyte apoptotic process,GO:2000108,5.5533980582524265,1.414291234285108e-07,symptomatic
fibroblast apoptotic process,GO:0044346,5.452427184466019,0.0032253513742210456,symptomatic
thymocyte apoptotic process,GO:0070242,5.452427184466019,0.003223037635789036,symptomatic
positive regulation of attachment of spindle microtubules to kinetochore,GO:0051987,5.452427184466019,0.003229988831265217,symptomatic
blood vessel endothelial cell differentiation,GO:0060837,5.452427184466019,0.003220727214544743,symptomatic
internal protein amino acid acetylation,GO:0006475,5.452427184466019,0.0032276684369898826,symptomatic
positive regulation of cytoplasmic translation,GO:2000767,5.33126213592233,0.0004707735494480454,symptomatic
positive regulation of lymphocyte apoptotic process,GO:0070230,5.292061679040548,0.00017843742414722088,symptomatic
regulation of establishment of endothelial barrier,GO:1903140,5.292061679040548,0.00017880609651116142,symptomatic
regulation of endothelial cell development,GO:1901550,5.292061679040548,0.00017862157009577322,symptomatic
negative regulation of anoikis,GO:2000811,5.2611139499233515,6.769400817978807e-05,symptomatic
regulation of anoikis,GO:2000209,5.197980582524273,3.550887969233144e-06,symptomatic
"regulation of nuclear-transcribed mRNA catabolic process, deadenylation-dependent decay",GO:1900151,5.183171521035598,1.330773374156969e-06,symptomatic
inflammatory response to wounding,GO:0090594,4.998058252427185,0.0020938497338833743,symptomatic
ectodermal placode development,GO:0071696,4.998058252427185,0.002095444440459066,symptomatic
dosage compensation by inactivation of X chromosome,GO:0009048,4.998058252427185,0.0020922574527169227,symptomatic
negative regulation of calcium ion-dependent exocytosis,GO:0045955,4.998058252427184,0.034664189970714965,symptomatic
epithelial to mesenchymal transition involved in endocardial cushion formation,GO:0003198,4.998058252427184,0.005337393408242153,symptomatic
T-helper 17 cell lineage commitment,GO:0072540,4.998058252427184,0.01344866699985592,symptomatic
ectodermal placode formation,GO:0060788,4.998058252427184,0.005340859248117635,symptomatic
ectodermal placode morphogenesis,GO:0071697,4.998058252427184,0.005354767735742941,symptomatic
regulation of long-chain fatty acid import into cell,GO:0140212,4.998058252427184,0.03485361177383363,symptomatic
endothelial cell activation,GO:0042118,4.998058252427184,0.013455940481197108,symptomatic
positive regulation of nucleocytoplasmic transport,GO:0046824,4.998058252427184,3.3728971008900144e-14,symptomatic
regulation of aspartic-type peptidase activity,GO:1905245,4.998058252427184,0.013477808206789519,symptomatic
type I pneumocyte differentiation,GO:0060509,4.998058252427184,0.03464849771631446,symptomatic
protein localization to cytoplasmic stress granule,GO:1903608,4.998058252427184,0.034679896445554435,symptomatic
anoikis,GO:0043276,4.998058252427184,0.005344329592008549,symptomatic
cytoplasmic sequestering of transcription factor,GO:0042994,4.998058252427184,0.01348511325188805,symptomatic
ubiquitin-dependent protein catabolic process via the C-end degron rule pathway,GO:0140627,4.998058252427184,0.005358256183779255,symptomatic
postsynaptic neurotransmitter receptor internalization,GO:0098884,4.998058252427184,0.03479024157060848,symptomatic
embryonic cleavage,GO:0040016,4.998058252427184,0.03480606250811216,symptomatic
cellular response to antibiotic,GO:0071236,4.998058252427184,0.005351283827001403,symptomatic
regulation of attachment of spindle microtubules to kinetochore,GO:0051988,4.998058252427184,4.4549937092961154e-05,symptomatic
renal system vasculature morphogenesis,GO:0061438,4.998058252427184,0.034695617160171645,symptomatic
positive regulation of attachment of mitotic spindle microtubules to kinetochore,GO:1902425,4.998058252427184,0.03488538352567851,symptomatic
glomerular mesangium development,GO:0072109,4.998058252427184,0.034901291133305354,symptomatic
positive regulation of cardiac muscle cell differentiation,GO:2000727,4.998058252427184,0.03491721325517274,symptomatic
regulation of deoxyribonuclease activity,GO:0032070,4.998058252427184,0.013499747124109307,symptomatic
I-kappaB phosphorylation,GO:0007252,4.998058252427184,0.03493314991115411,symptomatic
germinal center formation,GO:0002467,4.998058252427184,0.013521757581376876,symptomatic
clathrin coat disassembly,GO:0072318,4.998058252427184,0.0349491011211592,symptomatic
negative regulation of cell adhesion mediated by integrin,GO:0033629,4.998058252427184,0.005361749179987716,symptomatic
regulation of pro-B cell differentiation,GO:2000973,4.998058252427184,0.034965066905134144,symptomatic
regulation of cardiac epithelial to mesenchymal transition,GO:0062042,4.998058252427184,0.013470511071864349,symptomatic
regulation of germinal center formation,GO:0002634,4.998058252427184,0.034981047283061534,symptomatic
postsynaptic endocytosis,GO:0140239,4.998058252427184,0.03486949041245496,symptomatic
prostate glandular acinus development,GO:0060525,4.998058252427184,0.01344140137748971,symptomatic
regulation of vascular associated smooth muscle cell apoptotic process,GO:1905459,4.998058252427184,0.005347804448700363,symptomatic
synaptic vesicle endosomal processing,GO:0099532,4.998058252427184,0.03482189784137336,symptomatic
regulation of cell proliferation involved in heart morphogenesis,GO:2000136,4.998058252427184,0.0003082828141431143,symptomatic
"positive regulation of nuclear-transcribed mRNA catabolic process, deadenylation-dependent decay",GO:1900153,4.998058252427184,0.0008066013594230039,symptomatic
tongue morphogenesis,GO:0043587,4.998058252427184,0.013492426220028986,symptomatic
cellular response to leucine starvation,GO:1990253,4.998058252427184,0.013514412791816106,symptomatic
regulation of guanyl-nucleotide exchange factor activity,GO:1905097,4.998058252427184,0.034742864936604015,symptomatic
macrophage derived foam cell differentiation,GO:0010742,4.998058252427184,0.034727101386269804,symptomatic
regulation of dopaminergic neuron differentiation,GO:1904338,4.998058252427184,0.013463221834271349,symptomatic
negative regulation of fatty acid transport,GO:2000192,4.998058252427184,0.03483774759004945,symptomatic
kidney vasculature morphogenesis,GO:0061439,4.998058252427184,0.03471135213394043,symptomatic
negative regulation of gene expression via CpG island methylation,GO:0044027,4.998058252427184,0.03475864280442263,symptomatic
mitochondrial fragmentation involved in apoptotic process,GO:0043653,4.998058252427184,0.013507075977053992,symptomatic
regulation of cyclic-nucleotide phosphodiesterase activity,GO:0051342,4.998058252427184,0.034774435009240635,symptomatic
positive regulation of smooth muscle cell apoptotic process,GO:0034393,4.998058252427184,0.0008059011846318382,symptomatic
regulation of cytoplasmic translation,GO:2000765,4.846601941747573,5.40418343712644e-07,symptomatic
response to muscle stretch,GO:0035994,4.798135922330098,2.797395171566008e-05,symptomatic
positive regulation of protein import into nucleus,GO:0042307,4.760055478502081,1.652487353608492e-08,symptomatic
positive regulation of protein export from nucleus,GO:0046827,4.735002554931016,0.0005013417805638075,symptomatic
protein localization to cell-cell junction,GO:0150105,4.735002554931016,0.0005018025726415315,symptomatic
response to hepatocyte growth factor,GO:0035728,4.70405482581382,0.0013243280342431932,symptomatic
positive regulation of cyclin-dependent protein kinase activity,GO:1904031,4.70405482581382,0.0013221390622857663,symptomatic
regulation of miRNA processing,GO:1903798,4.70405482581382,0.001323232642982446,symptomatic
leukocyte apoptotic process,GO:0071887,4.679033257591406,3.837113813154472e-09,symptomatic
columnar/cuboidal epithelial cell maturation,GO:0002069,4.664854368932039,0.0033571434123391927,symptomatic
T-helper cell lineage commitment,GO:0002295,4.664854368932039,0.0033619324899602184,symptomatic
positive regulation of MHC class II biosynthetic process,GO:0045348,4.664854368932039,0.0033595362444221143,symptomatic
regulation of hematopoietic stem cell proliferation,GO:1902033,4.664854368932039,0.0033547539864229366,symptomatic
"negative regulation of DNA damage response, signal transduction by p53 class mediator",GO:0043518,4.664854368932039,0.0033523679594055665,symptomatic
motor neuron apoptotic process,GO:0097049,4.664854368932039,0.0033499853240399617,symptomatic
regulation of nuclear-transcribed mRNA poly(A) tail shortening,GO:0060211,4.664854368932039,0.003364332156262831,symptomatic
positive regulation of mitotic metaphase/anaphase transition,GO:0045842,4.664854368932039,0.0033476060730995923,symptomatic
