pathway,pthwy_id,fold_enrichment,q-value,cohort
positive regulation of RNA biosynthetic process,GO:1902680,2.000389708964439,1.528219479462427e-36,symptomatic
integrin-mediated signaling pathway,GO:0007229,1.999223300970874,0.017721300678216027,symptomatic
regulation of lymphocyte differentiation,GO:0045619,1.999223300970874,0.00015489949118616665,symptomatic
positive regulation of interleukin-6 production,GO:0032755,1.999223300970874,0.017712147113816124,symptomatic
response to starvation,GO:0042594,1.999223300970874,0.00015473592255767018,symptomatic
negative regulation of RNA metabolic process,GO:0051253,1.9992233009708738,2.381988713519143e-29,symptomatic
negative regulation of lymphocyte proliferation,GO:0050672,1.9992233009708738,0.028812712364558665,symptomatic
macromolecule catabolic process,GO:0009057,1.9992233009708738,2.1617096272328427e-19,symptomatic
response to unfolded protein,GO:0006986,1.9992233009708735,0.009266013817690025,symptomatic
embryonic organ development,GO:0048568,1.9992233009708735,3.001106660490332e-09,symptomatic
mRNA destabilization,GO:0061157,1.9992233009708735,0.04858042919527848,symptomatic
positive regulation of DNA-templated transcription,GO:0045893,1.9980548478434799,2.3957194695866563e-36,symptomatic
negative regulation of RNA biosynthetic process,GO:1902679,1.9930433216788466,1.4126672934826454e-26,symptomatic
intracellular protein transport,GO:0006886,1.9921713669286485,3.401034686168793e-11,symptomatic
phospholipid biosynthetic process,GO:0008654,1.9909277686017,6.529148453787718e-05,symptomatic
regulation of muscle system process,GO:0090257,1.9903771801701176,0.00010219771648116532,symptomatic
regulation of innate immune response,GO:0045088,1.989967637540453,1.2224868620125706e-08,symptomatic
regulation of cell motility,GO:2000145,1.9892271844660196,4.7407685934624604e-20,symptomatic
negative regulation of signaling,GO:0023057,1.9877828242843452,1.347543610146982e-28,symptomatic
intracellular signal transduction,GO:0035556,1.9873388824049967,4.374173224978699e-31,symptomatic
chordate embryonic development,GO:0043009,1.9871797871096033,4.076577616969805e-13,symptomatic
T cell activation,GO:0042110,1.986805764939999,2.1447720601608787e-06,symptomatic
renal system development,GO:0072001,1.9866099047502372,2.816273633658727e-06,symptomatic
kidney development,GO:0001822,1.9861990449384903,3.3943912910150703e-06,symptomatic
regulation of cold-induced thermogenesis,GO:0120161,1.9859834115604706,0.003281181378664431,symptomatic
response to radiation,GO:0009314,1.9852100535341621,1.700057757906204e-08,symptomatic
developmental growth involved in morphogenesis,GO:0060560,1.985044412311506,0.003807149205338309,symptomatic
small GTPase-mediated signal transduction,GO:0007264,1.983962054398577,2.542973736963693e-05,symptomatic
positive regulation of intracellular signal transduction,GO:1902533,1.983888894060263,8.543184637662088e-21,symptomatic
regulation of protein-containing complex disassembly,GO:0043244,1.9833564493758669,0.007783184351492932,symptomatic
negative regulation of peptidase activity,GO:0010466,1.9833564493758669,0.007778397645249702,symptomatic
regulation of synapse organization,GO:0050807,1.9827007943512798,6.875241594474425e-05,symptomatic
positive regulation of biosynthetic process,GO:0009891,1.982415958625785,0.00879695978193596,asymptomatic
negative regulation of cell communication,GO:0010648,1.9820503019646816,3.592122397524323e-28,symptomatic
regulation of neuron projection development,GO:0010975,1.9818008756900816,5.154461796433656e-09,symptomatic
positive regulation of plasma membrane bounded cell projection assembly,GO:0120034,1.9812122802414065,0.016481895287247608,symptomatic
positive regulation of RNA metabolic process,GO:0051254,1.9808718991801046,2.098618178184998e-38,symptomatic
response to ketone,GO:1901654,1.9807972797637687,0.00017878038785117752,symptomatic
positive regulation of cellular metabolic process,GO:0031325,1.9797665369649804,0.0028618181157779314,asymptomatic
leukocyte activation,GO:0045321,1.9795909935963643,6.772502678726887e-12,symptomatic
negative regulation of cell motility,GO:2000146,1.9794290108622514,6.911395379299625e-06,symptomatic
negative regulation of macromolecule biosynthetic process,GO:0010558,1.9788527578751005,4.205986514598316e-43,symptomatic
negative regulation of cell migration,GO:0030336,1.9783980582524272,1.0120147867680834e-05,symptomatic
regulation of non-canonical NF-kappaB signal transduction,GO:1901222,1.978398058252427,0.024395645196000116,symptomatic
establishment of chromosome localization,GO:0051303,1.978398058252427,0.02440759798639502,symptomatic
negative regulation of mononuclear cell proliferation,GO:0032945,1.9772538141470182,0.030883952953420012,symptomatic
tube development,GO:0035295,1.9771324357667759,1.0513281656620316e-17,symptomatic
pyrimidine-containing compound metabolic process,GO:0072527,1.975976518401445,0.039378966908114155,symptomatic
immune system development,GO:0002520,1.9752805069472703,0.0016182045585113544,symptomatic
regulation of pattern recognition receptor signaling pathway,GO:0062207,1.9745415318230852,0.0020546252800561007,symptomatic
hexose metabolic process,GO:0019318,1.9745415318230852,0.002056206977731279,symptomatic
protein-DNA complex organization,GO:0071824,1.9735323473369024,1.3417759021050278e-16,symptomatic
peptide biosynthetic process,GO:0043043,1.9710652263093122,3.7890941627935834e-08,symptomatic
response to lipid,GO:0033993,1.9710652263093122,1.8978332836246145e-16,symptomatic
positive regulation of mRNA metabolic process,GO:1903313,1.9689320388349516,0.00648894552902086,symptomatic
positive regulation of cell-substrate adhesion,GO:0010811,1.9677394694595214,0.008173514091913959,symptomatic
mRNA catabolic process,GO:0006402,1.9677394694595214,0.008178405482752926,symptomatic
regulation of protein transport,GO:0051223,1.9675613934894347,1.7980138888421158e-08,symptomatic
Notch signaling pathway,GO:0007219,1.9650485436893204,0.01332867534862656,symptomatic
nuclear chromosome segregation,GO:0098813,1.9650485436893204,0.00013249205483529278,symptomatic
negative regulation of nitrogen compound metabolic process,GO:0051172,1.9645018725262242,5.883752176872326e-45,symptomatic
regulation of proteolysis involved in protein catabolic process,GO:1903050,1.9643023699495485,0.00017019799867185623,symptomatic
RNA catabolic process,GO:0006401,1.9635228848821085,0.0017415094922211825,symptomatic
negative regulation of cellular biosynthetic process,GO:0031327,1.9632694507877722,4.581660889649709e-43,symptomatic
endosomal transport,GO:0016197,1.9615021066129326,4.264227160553265e-05,symptomatic
positive regulation of nucleobase-containing compound metabolic process,GO:0045935,1.9613555453915323,1.0712659541468284e-41,symptomatic
protein localization to organelle,GO:0033365,1.9613489759186515,6.422090333396161e-14,symptomatic
regulation of cellular localization,GO:0060341,1.961200034986443,6.475452959867966e-19,symptomatic
negative regulation of biosynthetic process,GO:0009890,1.95974639516891,4.726410079925729e-43,symptomatic
regulation of intracellular signal transduction,GO:1902531,1.9588122741123946,3.2452987242058536e-35,symptomatic
negative regulation of cell-cell adhesion,GO:0022408,1.9580022019817835,0.0007210780037270341,symptomatic
chromosome segregation,GO:0007059,1.9570710024564273,3.2879167250468823e-06,symptomatic
regulation of proteasomal protein catabolic process,GO:0061136,1.956911696717522,0.0009252041920008436,symptomatic
positive regulation of hemopoiesis,GO:1903708,1.956911696717522,0.0009259929423776559,symptomatic
positive regulation of leukocyte differentiation,GO:1902107,1.956911696717522,0.0009267830387448724,symptomatic
positive regulation of nitrogen compound metabolic process,GO:0051173,1.9565043362241497,0.007791930964043715,asymptomatic
negative regulation of leukocyte cell-cell adhesion,GO:1903038,1.9557619248628113,0.007846792899781695,symptomatic
monosaccharide metabolic process,GO:0005996,1.955761924862811,0.0012190335708556317,symptomatic
embryo development ending in birth or egg hatching,GO:0009792,1.9554446885408545,9.904437806646697e-13,symptomatic
negative regulation of innate immune response,GO:0045824,1.9532641446267158,0.042278624996945735,symptomatic
regulation of transcription elongation by RNA polymerase II,GO:0034243,1.9532641446267158,0.042260049151165,symptomatic
muscle structure development,GO:0061061,1.952819665358397,1.7646249995072878e-09,symptomatic
negative regulation of locomotion,GO:0040013,1.9519044062733382,2.6261495895654105e-06,symptomatic
protein ubiquitination,GO:0016567,1.9512419417475728,1.3886128797681034e-11,symptomatic
protein modification by small protein conjugation,GO:0032446,1.9508090614886733,5.136603459338596e-13,symptomatic
response to interleukin-1,GO:0070555,1.9504617570447549,0.010992197203079701,symptomatic
protein targeting,GO:0006605,1.9504617570447549,9.169727258240877e-05,symptomatic
negative regulation of inflammatory response,GO:0050728,1.9504617570447549,0.0023398165903327946,symptomatic
regulation of plasma membrane bounded cell projection organization,GO:0120035,1.9504617570447549,3.952695264221507e-12,symptomatic
regulation of cellular component biogenesis,GO:0044087,1.9499611251769304,5.050287987493571e-18,symptomatic
regulation of locomotion,GO:0040012,1.9474200100627994,2.080472469524797e-19,symptomatic
positive regulation of cell population proliferation,GO:0008284,1.9466121614716403,1.471211426492674e-17,symptomatic
positive regulation of metabolic process,GO:0009893,1.9463296585103522,0.002045130332628606,asymptomatic
positive regulation of catalytic activity,GO:0043085,1.9449457452884067,4.1360606517642583e-16,symptomatic
negative regulation of Wnt signaling pathway,GO:0030178,1.942102635228849,0.0021326584221583104,symptomatic
negative regulation of organelle organization,GO:0010639,1.9412747994934567,2.310669448037503e-06,symptomatic
response to cytokine,GO:0034097,1.9409934960882271,5.505004259338537e-15,symptomatic
maintenance of location,GO:0051235,1.940422615648201,0.002811162073569108,symptomatic
regulation of lymphocyte proliferation,GO:0050670,1.9401745114907214,0.00016034380529027253,symptomatic
embryonic organ morphogenesis,GO:0048562,1.940035769034236,1.2368230893584377e-05,symptomatic
regulation of leukocyte cell-cell adhesion,GO:1903037,1.939947138408395,9.176198582288676e-07,symptomatic
maintenance of location in cell,GO:0051651,1.938022587675847,0.039459383940729786,symptomatic
DNA replication,GO:0006260,1.938022587675847,0.0008145111767665751,symptomatic
cellular response to interleukin-1,GO:0071347,1.938022587675847,0.03947688255888532,symptomatic
regulation of steroid metabolic process,GO:0019218,1.938022587675847,0.03949439670376504,symptomatic
regulation of developmental process,GO:0050793,1.937254901960784,0.035549997317452516,asymptomatic
response to nutrient,GO:0007584,1.936747572815534,0.0032055116066159036,symptomatic
negative regulation of defense response,GO:0031348,1.936006753904601,0.00011002404081763324,symptomatic
sensory organ morphogenesis,GO:0090596,1.93586763298236,3.527951231100757e-05,symptomatic
regulation of multicellular organismal process,GO:0051239,1.9355360755225892,0.009098769452075514,asymptomatic
negative regulation of cellular metabolic process,GO:0031324,1.9354844554500295,3.901909123499388e-51,symptomatic
regulation of calcium-mediated signaling,GO:0050848,1.9347322267460068,0.03560602954864506,symptomatic
positive regulation of neuron differentiation,GO:0045666,1.9347322267460068,0.035622046655954386,symptomatic
positive regulation of nitrogen compound metabolic process,GO:0051173,1.9338717721199248,3.3622568079405246e-61,symptomatic
post-translational protein modification,GO:0043687,1.9321197411003235,2.2600394745972858e-15,symptomatic
cellular component disassembly,GO:0022411,1.932022517744962,2.17617391936582e-06,symptomatic
regulation of microtubule-based process,GO:0032886,1.9310679611650488,6.95450584859014e-05,symptomatic
nuclear division,GO:0000280,1.930714091280283,9.07357527653836e-06,symptomatic
positive regulation of gene expression,GO:0010628,1.9298175809541034,2.2325520735097897e-21,symptomatic
regulation of protein localization,GO:0032880,1.9296655879180151,6.257180011554864e-16,symptomatic
regulation of response to cytokine stimulus,GO:0060759,1.9290751149718957,0.002916140218588322,symptomatic
negative regulation of nucleobase-containing compound metabolic process,GO:0045934,1.9288464702978443,3.985748631717808e-28,symptomatic
regulation of protein localization to cell periphery,GO:1904375,1.9278224687933425,0.008309806003620959,symptomatic
positive regulation of innate immune response,GO:0045089,1.9278224687933425,4.8522416259058486e-05,symptomatic
glycerolipid biosynthetic process,GO:0045017,1.9275022856894073,0.00035798491030475935,symptomatic
negative regulation of cellular component organization,GO:0051129,1.9266258068015403,1.3342926617693136e-12,symptomatic
mRNA transport,GO:0051028,1.9251779935275082,0.010733304551217368,symptomatic
hindbrain development,GO:0030902,1.9247180847856242,0.0034124250889543085,symptomatic
skeletal muscle organ development,GO:0060538,1.9223300970873785,0.0043413987208572756,symptomatic
regulation of establishment of protein localization,GO:0070201,1.9216194390108214,1.8633958796617603e-09,symptomatic
regulation of hydrolase activity,GO:0051336,1.921296586282493,5.785032355267873e-13,symptomatic
regulation of T cell activation,GO:0050863,1.9203065917220237,1.2895696039167629e-06,symptomatic
placenta development,GO:0001890,1.919783964508455,0.005414385023673106,symptomatic
positive regulation of leukocyte cell-cell adhesion,GO:1903039,1.9195441114394258,6.616677847025372e-05,symptomatic
negative regulation of neuron projection development,GO:0010977,1.9170634392871393,0.006961438559596906,symptomatic
positive regulation of macromolecule biosynthetic process,GO:0010557,1.9170506912442398,0.03353906690732562,asymptomatic
regulation of response to stress,GO:0080134,1.9166595068304837,4.790835272133592e-24,symptomatic
eye morphogenesis,GO:0048592,1.9128371089536138,0.005049868128755831,symptomatic
embryonic morphogenesis,GO:0048598,1.9120088616667752,3.3764021949916063e-10,symptomatic
regulation of T cell differentiation,GO:0045580,1.911825561037721,0.0019509513152746742,symptomatic
cellular response to cytokine stimulus,GO:0071345,1.9112244761688546,2.0891065022879737e-12,symptomatic
positive regulation of molecular function,GO:0044093,1.9106604968261427,3.589112057586538e-21,symptomatic
mitochondrial transport,GO:0006839,1.9093705683429694,0.002484049199615261,symptomatic
regulation of cell-cell adhesion,GO:0022407,1.9089093120153109,2.5735573740190067e-08,symptomatic
regulation of mononuclear cell proliferation,GO:0032944,1.9079724449099624,0.00027752429418746374,symptomatic
peptidyl-lysine modification,GO:0018205,1.9076558215370933,0.014406730776426234,symptomatic
sex differentiation,GO:0007548,1.9073861882054273,5.6927802631071895e-05,symptomatic
DNA-templated transcription initiation,GO:0006352,1.907153806847215,0.005824987037136322,symptomatic
positive regulation of cell-cell adhesion,GO:0022409,1.9069514563106795,1.150847186374003e-05,symptomatic
regulation of developmental process,GO:0050793,1.9069388920616792,1.5833754339062503e-45,symptomatic
regulation of molecular function,GO:0065009,1.9066297915135573,2.04279451382201e-36,symptomatic
vacuole organization,GO:0007033,1.9064758282454208,0.0018046107182451648,symptomatic
regulation of organelle organization,GO:0033043,1.9064323460734913,1.910104341650329e-20,symptomatic
positive regulation of cellular biosynthetic process,GO:0031328,1.9049888309754281,0.032554448214539525,asymptomatic
neural tube formation,GO:0001841,1.9040221914008322,0.03329246355338601,symptomatic
regulation of cell morphogenesis,GO:0022604,1.9020950434338273,0.0002274191081395559,symptomatic
positive regulation of macromolecule metabolic process,GO:0010604,1.9014356870788165,0.009116614943385245,asymptomatic
positive regulation of response to external stimulus,GO:0032103,1.9014352047277332,2.8650071221649254e-09,symptomatic
protein-containing complex localization,GO:0031503,1.9011019119661683,0.005217764491841847,symptomatic
platelet activation,GO:0030168,1.8992621359223303,0.04278005164371929,symptomatic
regulation of cell population proliferation,GO:0042127,1.8966378571263063,3.368559388678151e-29,symptomatic
positive regulation of T cell activation,GO:0050870,1.8964964119881806,0.000190569332002428,symptomatic
regulation of protein-containing complex assembly,GO:0043254,1.894998389545852,6.176670866924628e-07,symptomatic
positive regulation of leukocyte migration,GO:0002687,1.8946887492861224,0.006198496658459163,symptomatic
regulation of viral process,GO:0050792,1.892755787901419,0.004309403319779991,symptomatic
inner ear development,GO:0048839,1.8924686586860213,0.0011762567754459053,symptomatic
cell morphogenesis involved in neuron differentiation,GO:0048667,1.8923605855514953,1.7640478103991793e-07,symptomatic
protein modification by small protein conjugation or removal,GO:0070647,1.890489277185066,2.533990352729938e-13,symptomatic
establishment of RNA localization,GO:0051236,1.8895098271371065,0.005404468225251235,symptomatic
ear development,GO:0043583,1.8876786532772198,0.0005130175045029464,symptomatic
positive regulation of lymphocyte proliferation,GO:0050671,1.887378640776699,0.009807341087403927,symptomatic
regulation of chromosome organization,GO:0033044,1.8868171715990174,0.000261607695427817,symptomatic
brain development,GO:0007420,1.8860597178970506,4.021443979315988e-12,symptomatic
negative regulation of immune system process,GO:0002683,1.8841886269070736,3.194760565824927e-08,symptomatic
cytoskeleton-dependent intracellular transport,GO:0030705,1.8840847862552734,0.0024936307797764363,symptomatic
protein localization to plasma membrane,GO:0072659,1.8833262980160406,0.0012507750985635828,symptomatic
positive regulation of small molecule metabolic process,GO:0062013,1.8833262980160406,0.012348652139877896,symptomatic
multicellular organismal-level homeostasis,GO:0048871,1.8814294567238172,9.312942586561543e-10,symptomatic
negative regulation of macromolecule metabolic process,GO:0010605,1.881216252925832,1.4944733437284672e-46,symptomatic
head development,GO:0060322,1.8805825242718444,8.877840784273486e-13,symptomatic
regulation of plasma membrane bounded cell projection assembly,GO:0120032,1.8804575603191387,0.0015962885977701623,symptomatic
regulation of leukocyte proliferation,GO:0070663,1.8789692678297685,0.00018313969195362238,symptomatic
phosphorylation,GO:0016310,1.8784648465498144,6.7302255256673e-12,symptomatic
glycerophospholipid metabolic process,GO:0006650,1.8764041220716392,7.99154823601793e-05,symptomatic
inner ear morphogenesis,GO:0042472,1.8742718446601943,0.02948024348534762,symptomatic
muscle cell differentiation,GO:0042692,1.8720642217571786,0.00013562780554802898,symptomatic
response to organic substance,GO:0010033,1.8719926328507168,6.480308626401399e-43,symptomatic
peptidyl-amino acid modification,GO:0018193,1.8707287976948632,2.0694143392145724e-08,symptomatic
vacuolar transport,GO:0007034,1.8706182933060806,0.004712046583673593,symptomatic
regulation of inflammatory response,GO:0050727,1.8676954522227902,5.169968267441309e-06,symptomatic
Golgi vesicle transport,GO:0048193,1.8654724463284562,0.0001408266480614244,symptomatic
cell migration,GO:0016477,1.8638707800394385,4.23596664368116e-14,symptomatic
negative regulation of metabolic process,GO:0009892,1.8627840870078687,3.0488703481646538e-49,symptomatic
regulation of cell projection assembly,GO:0060491,1.8620217018846374,0.0017984580042613222,symptomatic
regulation of protein polymerization,GO:0032271,1.8620217018846374,0.0017970340470132927,symptomatic
embryo development,GO:0009790,1.8595230891938723,1.587730703534606e-16,symptomatic
regulation of interleukin-1 production,GO:0032652,1.8576853681587764,0.04357412912989563,symptomatic
learning or memory,GO:0007611,1.8564216366158113,0.00018827800619885588,symptomatic
response to inorganic substance,GO:0010035,1.8553398058252428,4.514425686689712e-08,symptomatic
positive regulation of macromolecule metabolic process,GO:0010604,1.853953046461417,6.916426752056653e-61,symptomatic
RNA transport,GO:0050658,1.8511326860841424,0.008069735389498468,symptomatic
lysosomal transport,GO:0007041,1.8511326860841424,0.017697386856183845,symptomatic
nucleic acid transport,GO:0050657,1.8511326860841424,0.008064802788404643,symptomatic
positive regulation of macromolecule biosynthetic process,GO:0010557,1.8502796295467767,1.822273382073025e-43,symptomatic
regulation of chemotaxis,GO:0050920,1.8495017321756981,0.0010478717729768613,symptomatic
macroautophagy,GO:0016236,1.8492815533980584,0.002392903817248775,symptomatic
response to virus,GO:0009615,1.8491475571982616,1.0123148200050403e-05,symptomatic
regulation of G protein-coupled receptor signaling pathway,GO:0008277,1.848596887884027,0.01574586245788147,symptomatic
positive regulation of mononuclear cell proliferation,GO:0032946,1.848596887884027,0.01575415848657372,symptomatic
transcription initiation at RNA polymerase II promoter,GO:0006367,1.8480215387125725,0.03492881905308918,symptomatic
RNA localization,GO:0006403,1.847108484592655,0.004596159942525883,symptomatic
organelle localization,GO:0051640,1.8457180383734757,3.5307443413531575e-08,symptomatic
mitochondrion organization,GO:0007005,1.844385961032355,1.2143079252782478e-06,symptomatic
organelle fission,GO:0048285,1.8436641392238606,2.544456080949827e-05,symptomatic
regulation of MAPK cascade,GO:0043408,1.842602120710483,1.0415157472627667e-09,symptomatic
embryonic limb morphogenesis,GO:0030326,1.8392854368932041,0.02836929552624386,symptomatic
embryonic appendage morphogenesis,GO:0035113,1.8392854368932041,0.028355863094649995,symptomatic
regulation of leukocyte chemotaxis,GO:0002688,1.8392854368932041,0.02834244337714188,symptomatic
protein-RNA complex organization,GO:0071826,1.8389082249496245,0.002162508686671154,symptomatic
regulation of cytoskeleton organization,GO:0051493,1.8383662537663208,9.464389483168996e-08,symptomatic
DNA-templated transcription,GO:0006351,1.8360213988508025,6.565463927203781e-08,symptomatic
epithelium development,GO:0060429,1.8354705373449964,2.152756718217101e-16,symptomatic
RNA biosynthetic process,GO:0032774,1.8323189963526159,4.353253027242564e-08,symptomatic
negative regulation of response to stimulus,GO:0048585,1.8322208737864076,3.9710516307304903e-25,symptomatic
regulation of lymphocyte activation,GO:0051249,1.8319576064673344,2.728226050232767e-07,symptomatic
limb development,GO:0060173,1.8317490977481825,0.0040600000797416085,symptomatic
appendage development,GO:0048736,1.8317490977481825,0.004057184545705726,symptomatic
positive regulation of biosynthetic process,GO:0009891,1.8315750965673319,1.1198516285172278e-43,symptomatic
regulation of wound healing,GO:0061041,1.8313495886756097,0.023762923796882524,symptomatic
neuron migration,GO:0001764,1.830274853001504,0.020945606007270547,symptomatic
positive regulation of cellular component biogenesis,GO:0044089,1.829997706597355,2.1916619214334264e-07,symptomatic
positive regulation of lymphocyte activation,GO:0051251,1.8285578972294578,7.092087665272203e-05,symptomatic
positive regulation of supramolecular fiber organization,GO:1902905,1.827861303744799,0.007836656768757664,symptomatic
positive regulation of cellular biosynthetic process,GO:0031328,1.827287119837489,6.151525904214404e-43,symptomatic
respiratory electron transport chain,GO:0022904,1.8253777965386238,0.04666660998538083,symptomatic
cellular response to inorganic substance,GO:0071241,1.8253777965386238,0.001683898719855298,symptomatic
transcription by RNA polymerase II,GO:0006366,1.8242912621359224,1.0110211713506216e-05,symptomatic
positive regulation of production of molecular mediator of immune response,GO:0002702,1.8241088512507972,0.026869529259731406,symptomatic
cell morphogenesis,GO:0000902,1.8240040174087715,7.362094812627754e-10,symptomatic
skin development,GO:0043588,1.8238528359734287,0.00033475041183495094,symptomatic
positive regulation of protein secretion,GO:0050714,1.8236158488585674,0.01704790117378404,symptomatic
positive regulation of metabolic process,GO:0009893,1.8223627293066045,4.395078687389238e-63,symptomatic
developmental maturation,GO:0021700,1.8205985386848162,0.0002714184159486359,symptomatic
regulation of small molecule metabolic process,GO:0062012,1.8202804746494066,9.612736118099167e-05,symptomatic
positive regulation of defense response,GO:0031349,1.8196814025827128,6.445432163497137e-06,symptomatic
epithelial cell differentiation,GO:0030855,1.8188890063265337,4.411346563910561e-09,symptomatic
regulation of calcium ion transmembrane transport,GO:1903169,1.81747572815534,0.012587413110150016,symptomatic
limb morphogenesis,GO:0035108,1.8174757281553398,0.013941441286435893,symptomatic
appendage morphogenesis,GO:0035107,1.8174757281553398,0.013933973990620983,symptomatic
positive regulation of signal transduction,GO:0009967,1.8168961759461066,7.551679329528086e-23,symptomatic
morphogenesis of embryonic epithelium,GO:0016331,1.8113768163158923,0.017697621446740763,symptomatic
negative regulation of T cell activation,GO:0050868,1.8103203119027598,0.03147958850791293,symptomatic
axonogenesis,GO:0007409,1.8101075833114668,3.25811781830032e-05,symptomatic
regulation of alpha-beta T cell activation,GO:0046634,1.8096417810512222,0.048746914415019826,symptomatic
positive regulation of multicellular organismal process,GO:0051240,1.809224476362867,1.1095788865659733e-23,symptomatic
process utilizing autophagic mechanism,GO:0061919,1.8088210818307906,0.00016448493068866823,symptomatic
autophagy,GO:0006914,1.8088210818307906,0.00016465662685848938,symptomatic
